,,,,,,,,,,,,,,,
,,,,,,,,,,,,,,,
,,,,,,,,,,,,,,,
,,,,,,,,,,,,,,,
SEG - REPORTE GENERAL DE SOLICITUDES - GENERADO EN:20/02/2020 - 12:09:43,,,,,,,,,,,,,,,
SOLICITUD,SOLICITUD SC,NIS,TIPO DE SERVICIO,MOVIMIENTO,PRON‡STICO,ETAPA,FECHA DE SOLICITUD,FECHA CONVENIDA,FECHA DE ENTREGA,PROBLEMA PARA SU ATENCION,COMENTARIOS,PARO DE RELOJ,MOTIVO PARO DE RELOJ,INICIO PARO DE RELOJ FECHA/HORA,FIN PARO DE RELOJ FECHA/HORA
,,,,,,,,,,,,,,,
12516940,,1910200239669,Reventa Datos,Lineas Nuevas,,EN PROCESO,19/02/2020 20:15,,,,Elizabeth - 2020-02-19 20:15:59 - ACATLAN - HUAUCHINANGO ENTRADA A LA IZQUIERDA NAVES DE ARCOTECHO OK XD ,,,,
12516865,,1910200239628,Reventa Datos,Lineas Nuevas,,EN PROCESO,19/02/2020 19:41,,,,Elizabeth - 2020-02-19 19:41:58 - SE ENCUENTRA ESCUELA EN LA MISMA CALLE ,,,,
12516850,,1910200239618,Reventa Datos,Lineas Nuevas,,EN PROCESO,19/02/2020 19:33,,,,"Elizabeth - 2020-02-19 19:38:01 - A DOS CUADRAS DEL MERCADO DEL MERCADO LAS CRUCITAS , CASI ESQUINA CON MARGARITA DE JUAREZ OK XD ",,,,
12516811,,1910200239590,Reventa Datos,Lineas Nuevas,,CREADA/EN PROCESO,19/02/2020 19:16,,19/02/2020 19:21,,Elizabeth - 2020-02-19 19:16:59 - Casa de un nivel color gris zagu†n cafÇ OK XD ,,,,
12516806,,1910200239588,Reventa Datos,Lineas Nuevas,,CREADA/EN PROCESO,19/02/2020 19:14,25/02/2020,,,,,,,
12516758,,1910200239546,Reventa Datos,Lineas Nuevas,,CREADA/EN PROCESO,19/02/2020 19:07,,19/02/2020 19:11,,Elizabeth - 2020-02-19 19:08:29 - Casa de un nivel zagu†n color gris de reja OK XD ,,,,
12516742,,1910200239538,Reventa Datos,Lineas Nuevas,,EN PROCESO,19/02/2020 19:00,,,,Elizabeth - 2020-02-19 19:01:11 - CASA DE UN PISO COLOR BLANCO PORTON NEGRO OK XD ,,,,
12516597,,1910200239470,Reventa Datos,Lineas Nuevas,,EN PROCESO,19/02/2020 18:33,,,,,,,,
12516478,,1910200239437,Reventa Datos,Lineas Nuevas,,EN PROCESO,19/02/2020 18:08,,,,Elizabeth - 2020-02-19 18:16:17 - SIN ,,,,
12516430,,1910200239417,Reventa Datos,Lineas Nuevas,,CREADA/EN PROCESO,19/02/2020 17:59,,19/02/2020 18:04,,Elizabeth - 2020-02-19 18:00:59 - A LADO DE LA LIGA DE ARBITROS OK XD ,,,,
12516415,,1910200239413,Reventa Datos,Lineas Nuevas,,EN PROCESO,19/02/2020 17:56,,,,Elizabeth - 2020-02-19 17:58:13 - SIN ,,,,
12516345,,1910200239404,Reventa Datos,Lineas Nuevas,,CREADA/EN PROCESO,19/02/2020 17:51,,19/02/2020 17:57,,Elizabeth - 2020-02-19 17:52:58 - FRENTE A CIBERCAFE Y UNA TIENDA DE ABARROTES OK XD ,,,,
12516265,,1910200239370,Reventa Datos,Lineas Nuevas,,EN PROCESO,19/02/2020 17:32,,,,"Elizabeth - 2020-02-19 17:35:55 - A 10 MTS DE UN KINDER, CASA DE UN PISO COLOR VERDE LIMON ",,,,
12516241,,1910200239366,Reventa Datos,Lineas Nuevas,,CREADA/EN PROCESO,19/02/2020 17:25,,19/02/2020 17:33,,Elizabeth - 2020-02-19 17:26:30 - A un costado de la casa de cultura OK XD ,,,,
12516236,,1910200239356,Reventa Datos,Suspension,,LIQUIDADA,19/02/2020 17:22,,19/02/2020 17:51,,Victor - 2020-02-19 17:26:09 - SUSPENSION ,,,,
12516217,,1910200239348,Reventa Datos,Suspension,,LIQUIDADA,19/02/2020 17:18,,19/02/2020 17:27,,Victor - 2020-02-19 17:21:31 - SUSPENSION ,,,,
12516185,,1910200239322,Reventa Datos,Suspension,,LIQUIDADA,19/02/2020 17:06,,19/02/2020 17:11,,Victor - 2020-02-19 17:09:33 - SUSPENSION ,,,,
12516175,,1910200239309,Reventa Datos,Suspension,,LIQUIDADA,19/02/2020 17:03,,19/02/2020 17:11,,Victor - 2020-02-19 17:06:02 - SUSPENSION ,,,,
12516107,,1910200239291,Reventa Datos,Suspension,,LIQUIDADA,19/02/2020 16:53,,19/02/2020 17:04,,Victor - 2020-02-19 17:02:10 - SUSPENSION ,,,,
12516094,,1910200239284,Reventa Datos,Suspension,,LIQUIDADA,19/02/2020 16:50,,19/02/2020 16:55,,Victor - 2020-02-19 16:53:00 - SUSPENSION ,,,,
12516046,,1910200239273,Reventa Datos,Suspension,,LIQUIDADA,19/02/2020 16:48,,19/02/2020 16:55,,Victor - 2020-02-19 16:49:07 - SUSPENSION ,,,,
12516023,,1910200239257,Reventa Datos,Suspension,,LIQUIDADA,19/02/2020 16:42,,19/02/2020 16:46,,Victor - 2020-02-19 16:45:17 - SUSPENSION ,,,,
12516015,,1910200239247,Reventa Datos,Suspension,,LIQUIDADA,19/02/2020 16:40,,19/02/2020 16:43,,Victor - 2020-02-19 16:41:15 - SUSPENSION ,,,,
12515975,,1910200239229,Reventa Datos,Suspension,,LIQUIDADA,19/02/2020 16:33,,19/02/2020 16:38,,Victor - 2020-02-19 16:36:59 - SUSPENSION ,,,,
12515963,,1910200239217,Reventa Datos,Suspension,,LIQUIDADA,19/02/2020 16:30,,19/02/2020 16:34,,Victor - 2020-02-19 16:32:43 - SUSPENSION ,,,,
12515954,,1910200239212,Reventa Datos,Lineas Nuevas,,EN PROCESO,19/02/2020 16:28,,,,,,,,
12515947,,1910200239205,Reventa Datos,Suspension,,LIQUIDADA,19/02/2020 16:26,,19/02/2020 16:32,,Victor - 2020-02-19 16:29:25 - SUSPENSION ,,,,
12515931,,1910200239190,Reventa Datos,Suspension,,LIQUIDADA,19/02/2020 16:20,,19/02/2020 16:26,,Victor - 2020-02-19 16:23:55 - SUSPENSION ,,,,
12515923,,1910200239182,Reventa Datos,Lineas Nuevas,,CREADA/EN PROCESO,19/02/2020 16:17,,19/02/2020 16:22,,,,,,
12515920,,1910200239177,Reventa Datos,Suspension,,LIQUIDADA,19/02/2020 16:15,,19/02/2020 16:21,,Victor - 2020-02-19 16:18:44 - SUSPENSION ,,,,
12515909,,1910200239165,Reventa Datos,Lineas Nuevas,,EN PROCESO,19/02/2020 16:11,,,,"Elizabeth - 2020-02-19 16:29:39 - CERCA DE LA IGLESIA DE SAN MIGUEL, A UNA CUADRA DE LA UNIDAD DEPORTIVA RAFAEL GALINDO, CERCA DEL LLANO Y DEL RASTRO DE MASCOTA. OK XD ",,,,
12515902,,1910200239161,Reventa Datos,Suspension,,LIQUIDADA,19/02/2020 16:09,,19/02/2020 16:15,,Victor - 2020-02-19 16:14:48 - SUSPENSION ,,,,
12515899,,1910200239158,Reventa Datos,Lineas Nuevas,,EN PROCESO,19/02/2020 16:07,,,,Elizabeth - 2020-02-19 16:08:30 - 0 ,,,,
12515891,,1910200239145,Reventa Datos,Suspension,,LIQUIDADA,19/02/2020 16:02,,19/02/2020 16:10,,Victor - 2020-02-19 16:07:50 - SUSPENSION ,,,,
12515855,,1910200239094,Reventa Datos,Lineas Nuevas,,EN PROCESO,19/02/2020 15:39,,,,,,,,
12515843,,1910200239073,Reventa Datos,Lineas Nuevas,,CREADA/EN PROCESO,19/02/2020 15:33,,19/02/2020 15:37,,,,,,
12515832,,1910200239064,Reventa Datos,Lineas Nuevas,,EN PROCESO DE ALTA,19/02/2020 15:28,,,,,,,,
12515824,,1910200239053,Reventa Datos,Lineas Nuevas,,EN PROCESO,19/02/2020 15:19,,,,,,,,
12515803,,1910200239030,Reventa Datos,Lineas Nuevas,,EN PROCESO,19/02/2020 15:08,,,,,,,,
12515796,,1910200239026,Reventa Datos,Lineas Nuevas,,EN PROCESO,19/02/2020 15:04,,,,,,,,
12515754,,1910200238996,Reventa Datos,Lineas Nuevas,,EN PROCESO,19/02/2020 14:44,,,,,,,,
12515742,,1910200238985,Reventa Datos,Lineas Nuevas,,EN PROCESO,19/02/2020 14:36,,,,,,,,
12515675,,1910200238964,Reventa Datos,Lineas Nuevas,,EN PROCESO,19/02/2020 14:23,,,,"Elizabeth - 2020-02-19 14:25:23 - CASA COLOR ROJO QUEMADO, REJA AZUL CON GRISA L APRIVADA SE ENCUENTRA ATRAS DEL ""KINDER DE LA POPOCATEPETL"" ",,,,
12515587,,1910200238898,Reventa Datos,Lineas Nuevas,,EN PROCESO,19/02/2020 13:58,,,,,,,,
12515561,,1910200238876,Reventa Datos,Lineas Nuevas,,EN PROCESO,19/02/2020 13:52,,,,Juan - 2020-02-19 13:53:22 - A DOS CUADRAS DE LA GLORIETA ,,,,
12515558,,1910200238873,Reventa Datos,Lineas Nuevas,,EN PROCESO,19/02/2020 13:51,,,,,,,,
12515491,,1910200238826,Reventa Datos,Lineas Nuevas,,EN PROCESO,19/02/2020 13:34,,,,"Erick - 2020-02-19 13:48:18 - EN UNA EZQUINA ESTA UN ANA AURRERA , UN SUPER K, ENFRETE ESTA UN PARQUE Y UN ABOMBA DE AGUA, CASA COLOR AMARILLO CO FACHALETA CAFE. ",,,,
12515478,,1910200238805,Reventa Datos,Lineas Nuevas,,EN PROCESO,19/02/2020 13:27,,,,"Brayan - 2020-02-19 13:28:17 - EN LA BAJADA QUE ESTA A UN COSTADO DE LE ESCUELA PRIMARIA MIGUEL HIDALGO PREGUNTAR POR LA CASA DEL ENANO HEVERT, CASA DEL CLIENTE ESTA EN ESQUINA PASANDO EL IMSS Y LA PRIMARIA ",,,,
12515472,,1910200238800,Reventa Datos,Lineas Nuevas,,CREADA/EN PROCESO,19/02/2020 13:26,28/02/2020,19/02/2020 13:32,,Marian - 2020-02-19 15:34:20 - Se objeta solicitud cliente no desea el servicio a peticion de CS Erick Arellano. ,,,,
12515462,,1910200238792,Reventa Datos,Lineas Nuevas,,EN PROCESO,19/02/2020 13:23,,,,,,,,
12515457,,1910200238790,Reventa Datos,Lineas Nuevas,,EN PROCESO,19/02/2020 13:22,,,,,,,,
12515455,,1910200238785,Reventa Datos,Lineas Nuevas,,EN PROCESO,19/02/2020 13:21,,,,Erick - 2020-02-19 13:34:38 - ESTAN UNAS CANCHAS DE BASQUET Y ES EN UN PORTO DE PRIVADA COLOR NEGRO. ,,,,
12515357,,1910200238720,Reventa Datos,Lineas Nuevas,,EN PROCESO,19/02/2020 13:03,,,,,,,,
12515290,,1910200238688,Reventa Datos,Lineas Nuevas,,EN PROCESO,19/02/2020 12:54,,,,Elizabeth - 2020-02-19 12:55:36 - NA ,,,,
12515039,,1910200238579,Reventa Datos,Lineas Nuevas,,EN PROCESO,19/02/2020 12:21,,,,Elizabeth - 2020-02-19 12:26:17 - A TRES CUADRAS DE LA PRIMARIA 3 DE MAYO ,,,,
12515019,,1910200238552,Reventa Datos,Lineas Nuevas,,EN PROCESO,19/02/2020 12:14,,,,Elizabeth - 2020-02-19 12:35:25 - NA ,,,,
12514991,,1910200238528,Reventa Datos,Lineas Nuevas,,EN PROCESO,19/02/2020 12:05,,,,"Erick - 2020-02-19 12:16:56 - CASA COLOR VERDE AMARILLO Erick - 2020-02-19 12:13:22 - CALLE DE TERRACERIA, CASA DE UN SOLO PISO AMARILLA CON PORTON DE COLOR CAFE, ",,,,
12514971,,1910200238509,Reventa Datos,Lineas Nuevas,,EN PROCESO,19/02/2020 11:58,,,,Elizabeth - 2020-02-19 11:59:20 - NA ,,,,
12514967,,1910200238507,Reventa Datos,Lineas Nuevas,,EN PROCESO,19/02/2020 11:58,,,,Brayan - 2020-02-19 11:58:57 - FRENTE A DEPOSITO EL LUCAS ,,,,
12514944,,1910200238497,Reventa Datos,Lineas Nuevas,,EN PROCESO,19/02/2020 11:53,,,,"Erick - 2020-02-19 12:01:33 - SOBRE LA PRINCIPAL ENTRA DA A LA COLONIA, CENTRO CULTURA MEXIQUENCE DE HAI ENTRAR A LA COL Y A 300 MT ENTRE LAS ESCUELAS Y EL PANTEON A 250 MTS A UN LADO DE UN EDIFIDCIO ZAUL, ES EN SAHUAN CAFFE. ",,,,
12514939,,1910200238491,Reventa Datos,Lineas Nuevas,,EN PROCESO,19/02/2020 11:52,,,,,,,,
12514893,,1910200238448,Reventa Datos,Lineas Nuevas,,EN PROCESO,19/02/2020 11:41,,,,,,,,
12514879,,1910200238439,Reventa Datos,Lineas Nuevas,,EN PROCESO,19/02/2020 11:37,,,,Brayan - 2020-02-19 11:38:31 - CASA NEGRA CON ROJO ,,,,
12514799,,1910200238344,Reventa Datos,Lineas Nuevas,,EN PROCESO,19/02/2020 11:12,,,,Elizabeth - 2020-02-19 11:13:14 - NA ,,,,
12514786,,1910200238333,Reventa Datos,Lineas Nuevas,,EN PROCESO,19/02/2020 11:09,,,,,,,,
12514756,,1910200238300,Reventa Datos,Lineas Nuevas,,DOMICILIO SIN FACILIDADES,19/02/2020 11:04,,,,,,,,
12514752,,1910200238291,Reventa Datos,Lineas Nuevas,,EN PROCESO,19/02/2020 11:02,,,,,,,,
12514720,,1910200238256,Reventa Datos,Lineas Nuevas,,EN PROCESO,19/02/2020 10:54,,,,,,,,
12514704,,1910200238237,Reventa Datos,Lineas Nuevas,,OBJETADA,19/02/2020 10:50,,19/02/2020 10:59,,,,,,
12514699,,1910200238227,Reventa Datos,Lineas Nuevas,,EN PROCESO,19/02/2020 10:48,,,,"Erick - 2020-02-19 10:57:13 - ES POR LA CALLE PRICIPAL YEGANDO AL CENTRO ES LA UNICA CALLE PADIMENTADA, POR AHI ESTA UN ACANCHA DE FUTBOOL, CASA BEIHS CON BARABDALES BLANCO Y PORTON BLANCO. ",,,,
12514689,,1910200238205,Reventa Datos,Bajas,,LIQUIDADA,19/02/2020 10:44,,19/02/2020 20:43,,,,,,
12514666,,1910200238174,Reventa Datos,Lineas Nuevas,,EN PROCESO,19/02/2020 10:38,,,,,,,,
12514597,,1910200238132,Reventa Datos,Lineas Nuevas,,EN PROCESO,19/02/2020 10:26,,,,,,,,
12514558,,1910200238085,Reventa Datos,Lineas Nuevas,,EN PROCESO,19/02/2020 10:15,,,,,,,,
12514549,,1910200238083,Reventa Datos,Lineas Nuevas,,EN PROCESO,19/02/2020 10:14,26/02/2020,,,"Erick - 2020-02-19 10:22:28 - PRIMERO UBICAR PORTALES 1, ESTRAR POR A LA GASOLINERA 3 CUADRAS A MANO IZQUIERDA A L A 4 CASA COLOR BEIS CON FIGUARA EN LA PARTE DE ABAJO Y CUENTA CON UN TEJABAN BLANCO. ",,,,
12514539,,1910200238073,Reventa Datos,Lineas Nuevas,,EN PROCESO,19/02/2020 10:10,25/02/2020,,,,,,,
12514496,,1910200238024,Reventa Datos,Lineas Nuevas,,EN PROCESO,19/02/2020 09:56,,,,Elizabeth - 2020-02-19 09:56:58 - NA ,,,,
12514471,,1910200237987,Reventa Datos,Lineas Nuevas,,ALTA DE DOMICILIO,19/02/2020 09:48,01/03/2020,,,,,,,
12514464,,1910200237979,Reventa Datos,Lineas Nuevas,,EN PROCESO,19/02/2020 09:47,,,,Elizabeth - 2020-02-19 09:47:52 - REF. ESTA ENTRE FRENTE AL PARQUE DE SAN PREDRO COLOR LADRILLO ,,,,
12514463,,1910200237977,Reventa Datos,Lineas Nuevas,,EN PROCESO,19/02/2020 09:46,,,,,,,,
12514427,,1910200237926,Reventa Datos,Lineas Nuevas,,EN PROCESO,19/02/2020 09:33,,,,,,,,
12514419,,1910200237910,Reventa Datos,Lineas Nuevas,,EN PROCESO,19/02/2020 09:26,,,,,,,,
12514407,,1910200237890,Reventa Datos,Lineas Nuevas,,CREADA/EN PROCESO,19/02/2020 09:18,,19/02/2020 09:24,,,,,,
12514386,,1910200237868,Reventa Datos,Lineas Nuevas,,EN PROCESO,19/02/2020 09:09,,,,,,,,
12514374,,1910200237856,Reventa Datos,Lineas Nuevas,,DOMICILIO SIN FACILIDADES,19/02/2020 09:01,,,,,,,,
12514350,,1910200237819,Reventa Datos,Lineas Nuevas,,DOMICILIO SIN FACILIDADES,19/02/2020 08:39,,,,,,,,
12514336,,1910200237794,Reventa Datos,Lineas Nuevas,,DOMICILIO SIN FACILIDADES,19/02/2020 07:59,,,,,,,,
12514263,,1910200237770,Reventa Datos,Lineas Nuevas,,EN PROCESO,18/02/2020 20:49,,,,Elizabeth - 2020-02-18 20:51:13 - SIN COMENTARIOS ,,,,
12514251,,1910200237760,Reventa Datos,Lineas Nuevas,,EN PROCESO,18/02/2020 20:39,,,,"Elizabeth - 2020-02-18 20:49:58 - TIENE BARDA DE COLOR DE ROSA, DOS CASAS ESTA UNA ESCALERA A LOMO LINDA HACIA ABAGO. ",,,,
12514229,,1910200237731,Reventa Datos,Lineas Nuevas,,EN PROCESO,18/02/2020 20:24,,,,Juan - 2020-02-18 20:41:03 - SIN ,,,,
12514198,,1910200237689,Reventa Datos,Lineas Nuevas,,EN PROCESO,18/02/2020 20:05,,,,Elizabeth - 2020-02-18 20:18:00 - POR EL BULEBAR POR LA TIENDA EL KIESCO COMO A 5 MINUTOS ESTA LA CALLE CASA DE COLOR MOSTZA DE UN NIVEL ,,,,
12514191,,1910200237676,Reventa Datos,Lineas Nuevas,,EN PROCESO,18/02/2020 20:00,,,,"Elizabeth - 2020-02-18 20:10:11 - ESTA UNA TIENDA ESTER, AFUERA DE DOMICILIO ESTA UN BOCHOTO COLOR ROJO, CASA DE BLANCO CON AZUL DE DOS PISOS CON PUERTAS COLOR VERDES. ",,,,
12514160,,1910200237653,Reventa Datos,Lineas Nuevas,,EN PROCESO,18/02/2020 19:51,,,,Elizabeth - 2020-02-18 19:51:43 - DICC840606000 ,,,,
12514151,,1910200237645,Reventa Datos,Lineas Nuevas,,EN PROCESO,18/02/2020 19:50,,,,"Marian - 2020-02-18 20:24:36 - Se objeta solicitud con motivo domicilio no corresponde, valida CS Marili Martinez. ",,,,
12514130,,1910200237614,Reventa Datos,Lineas Nuevas,,EN PROCESO,18/02/2020 19:38,,,,,,,,
12514094,,1910200237603,Reventa Datos,Lineas Nuevas,,EN PROCESO,18/02/2020 19:34,25/02/2020,,,,,,,
12514069,,1910200237582,Reventa Datos,Lineas Nuevas,,EN PROCESO DE ALTA,18/02/2020 19:25,,,,"Elizabeth - 2020-02-18 19:29:06 - ES UN FRACIONAMINETO ESTA CASI EN FRENTE UNA PRIMARIA , A 2 CUADRAS ESTA UNA SECUNDARIA Y SERCA UN OXO ",,,,
12513984,,1910200237559,Reventa Datos,Lineas Nuevas,,EN PROCESO,18/02/2020 19:08,,,,,,,,
12513979,,1910200237557,Reventa Datos,Lineas Nuevas,,EN PROCESO,18/02/2020 19:08,,,,,,,,
12513899,,1910200237518,Reventa Datos,Lineas Nuevas,,EN PROCESO,18/02/2020 18:52,24/02/2020,,,,,,,
12513897,,1910200237516,Reventa Datos,Lineas Nuevas,,EN PROCESO,18/02/2020 18:52,,,,,,,,
12513885,,1910200237507,Reventa Datos,Lineas Nuevas,,EN PROCESO,18/02/2020 18:49,,,,"Elizabeth - 2020-02-18 18:50:26 - TODA LA CASAS ESTAN ENURADA NO HAY PIERDE, CASA BLANCOA CON CONEGRE DE DOS PISOS. ",,,,
12513873,,1910200237499,Reventa Datos,Lineas Nuevas,,EN PROCESO,18/02/2020 18:45,,,,,,,,
12513833,,1910200237470,Reventa Datos,Lineas Nuevas,,EN PROCESO,18/02/2020 18:33,,,,Marian - 2020-02-18 19:09:28 - Se objeta solicitud cliente no desea el servicio a peticion de CS Marili Martinez. ,,,,
12513799,,1910200237449,Reventa Datos,Lineas Nuevas,,EN PROCESO,18/02/2020 18:25,,,,Marian - 2020-02-18 18:59:11 - Se objeta solicitud cliente no desea el servicio a peticion de CS Marili Martinez. ,,,,
12513785,,1910200237442,Reventa Datos,Lineas Nuevas,,EN PROCESO,18/02/2020 18:19,,,,Elizabeth - 2020-02-18 18:22:11 - OK XD ,,,,
12513745,,1910200237403,Reventa Datos,Lineas Nuevas,,EN PROCESO,18/02/2020 18:07,,,,"Elizabeth - 2020-02-18 18:13:24 - CASA ATRAS DE CARRETERA 26, EN LA EZQUINA ESTA UN OXXO A MEDIO CUADRA ES UN SALON DE BELLESA CON PUERTA DE CRISTAL. ",,,,
12513718,,1910200237391,Reventa Datos,Lineas Nuevas,,EN PROCESO,18/02/2020 17:55,,,,Elizabeth - 2020-02-18 18:08:38 - ENFRENTE DE LA TAPICERIA ARERI CASA CON BARDA DE COLOR AMARILLO CON ROJO EN LA ESQUINA ,,,,
12513652,,1910200237365,Reventa Datos,Lineas Nuevas,,EN PROCESO,18/02/2020 17:38,,,,Elizabeth - 2020-02-18 17:39:30 - CERCA DE UNA FERRETERIA M Y L ,,,,
12513608,,1910200237317,Reventa Datos,Lineas Nuevas,,EN PROCESO,18/02/2020 17:21,,,,"Elizabeth - 2020-02-18 17:26:59 - A LADO DE UNA TIENDA DE ABBARROTE UNICA TIENDA, CASA CON UN SAHUAN NEGRO DE DOS PISOS LA PARTE DE ABAJO ES DE PIERDRA Y LA DE ARRIBA ESTA PIMNTAD DE COLOR NARANJA. ",,,,
12513584,,1910200237301,Reventa Datos,Lineas Nuevas,,EN PROCESO,18/02/2020 17:13,,,,Elizabeth - 2020-02-18 17:13:41 - CASA COLOR AZUL CERCA DE TIENDA A BARROTES REF 4443137514 FERNANDO DOMINGUEZ ,,,,
12513576,,1910200237293,Reventa Datos,Lineas Nuevas,,EN PROCESO,18/02/2020 17:10,,,,"Elizabeth - 2020-02-18 17:11:57 - loma verde, alado de una tele secundaria OK XD ",,,,
12513551,,1910200237280,Reventa Datos,Lineas Nuevas,,,18/02/2020 17:04,,18/02/2020 17:08,,Elizabeth - 2020-02-18 17:05:05 - CERCA DE LA SECUNDARIA EL DOM SE UBICA A 1 CUADRA ,,,,
12513528,,1910200237268,Reventa Datos,Lineas Nuevas,,EN PROCESO DE ALTA,18/02/2020 16:56,,,,"Elizabeth - 2020-02-18 16:56:30 - CASA DE UN PISO COLOR CREMA, CERCA HAY UNA TIENDA QUE SE LLAMA YULI CERCA HAY UNA IGLESIA QUE SE LLAMA IGLESIA ADVENTISTA REAL UNIDAD 22.925263, -109.922855 ",,,,
12513520,,1910200237258,Reventa Datos,Lineas Nuevas,,EN PROCESO,18/02/2020 16:52,,,,Marian - 2020-02-18 18:50:02 - Se objeta solicitud cliente no desea el servicio a peticion de CS Marilyn Martinez. ,,,,
12513499,,1910200237238,Reventa Datos,Lineas Nuevas,,EN PROCESO,18/02/2020 16:46,,,,Elizabeth - 2020-02-18 16:47:14 - CASA BLANCA AUN COSTADO DE LA FABRICA DE VELAS OK XD ,,,,
12513494,,1910200237232,Reventa Datos,Suspension,,LIQUIDADA,18/02/2020 16:44,,18/02/2020 16:50,,Victor - 2020-02-18 16:47:19 - SUSPENSION ,,,,
12513486,,1910200237222,Reventa Datos,Lineas Nuevas,,EN PROCESO,18/02/2020 16:41,,,,"Elizabeth - 2020-02-18 16:42:51 - DE LA SEC PARA ARRIBA, CERCA DEL PARQUE AL LA LADO DEL DEPOSITO CASA DE 2 PISOS COLOR GRIS , POR LA CARNICER÷A Y ABARROTES ",,,,
12513481,,1910200237219,Reventa Datos,Suspension,,LIQUIDADA,18/02/2020 16:41,,18/02/2020 16:43,,Victor - 2020-02-18 16:43:17 - SUSPENSION ,,,,
12513464,,1910200237212,Reventa Datos,Lineas Nuevas,,EN PROCESO,18/02/2020 16:39,,,,"Elizabeth - 2020-02-18 16:39:44 - Cancel Negro, calle empedrada, casa al fondo OK XD ",,,,
12513463,,1910200237210,Reventa Datos,Suspension,,LIQUIDADA,18/02/2020 16:38,,18/02/2020 16:40,,Victor - 2020-02-18 16:39:54 - SUSPENSION ,,,,
12513409,,1910200237157,Reventa Datos,Lineas Nuevas,,EN PROCESO,18/02/2020 16:17,,,,,,,,
12513380,,1910200237129,Reventa Datos,Lineas Nuevas,,CREADA/EN PROCESO,18/02/2020 16:08,,18/02/2020 16:19,,"Elizabeth - 2020-02-18 16:23:38 - ESTA UN CAMPO, EZQUINA ESTA UNA TIENDA DE ABARROTES LLAMADO SUPR BANDERAS Y DA LA BUELTA A 4 CASA COLOR ZAUL DE UN PISO CON PUERTAS BLANCAS. ",,,,
12513374,,1910200237126,Reventa Datos,Suspension,,LIQUIDADA,18/02/2020 16:05,,18/02/2020 16:10,,Victor - 2020-02-18 16:07:52 - SUSPENSION ,,,,
12513367,,1910200237123,Reventa Datos,Lineas Nuevas,,EN PROCESO,18/02/2020 16:03,,,,Elizabeth - 2020-02-18 16:04:30 - OK XD ,,,,
12513359,,1910200237115,Reventa Datos,Reanudacion,,LIQUIDADA,18/02/2020 16:01,,19/02/2020 07:48,,Victor - 2020-02-18 16:01:57 - REANUDACION ,,,,
12513333,,1910200237098,Reventa Datos,Reanudacion,,LIQUIDADA,18/02/2020 15:54,,18/02/2020 16:09,,Victor - 2020-02-18 15:55:13 - REANUDACION ,,,,
12513186,,1910200237047,Reventa Datos,Lineas Nuevas,,EN PROCESO,18/02/2020 15:17,,,,Elizabeth - 2020-02-18 16:11:16 - Elizabeth - 2020-02-18 16:11:11 - PASANDO LAS ANTENAS DE TELMEX EN LA SEGUNDA PRIVADA ESTA ALADO DE UNA TIENDA ,,,,
12513175,,1910200237039,Reventa Datos,Lineas Nuevas,,EN PROCESO,18/02/2020 15:10,,,,"Elizabeth - 2020-02-18 16:09:32 - ATRAS DEL UDITORIO, ESTA UNA TIENDA DEPOSITO DE CERVESA ES UN CALLEJON SIN SALIDA. CASA COLOR GRIS DE UN SOLO PISO. ",,,,
12513123,,1910200236978,Reventa Datos,Lineas Nuevas,,EN PROCESO,18/02/2020 14:34,,,,,,,,
12513118,,1910200236972,Reventa Datos,Lineas Nuevas,,EN PROCESO,18/02/2020 14:33,,,,"Elizabeth - 2020-02-18 14:34:06 - 28.698740, -100.516774 ",,,,
12513114,,1910200236963,Reventa Datos,Lineas Nuevas,,EN PROCESO,18/02/2020 14:31,,,,,,,,
12513068,,1910200236900,Reventa Datos,Lineas Nuevas,,EN PROCESO,18/02/2020 14:09,,,,,,,,
12513066,,1910200236892,Reventa Datos,Lineas Nuevas,,EN PROCESO,18/02/2020 14:06,,,,"Elizabeth - 2020-02-18 14:07:07 - CASA BLANCA DE 2 PISOS A UN LADO DE UN BAR CON UN LETRERO DED NO ESTACIONARSE EN EL PORTON (14.9071978,-92.2567871) ",,,,
12513063,,1910200236889,Reventa Datos,Lineas Nuevas,,EN PROCESO,18/02/2020 14:05,,,,Cecilia - 2020-02-18 14:07:46 - casa de un piso sin pintar ,,,,
12513008,,1910200236860,Reventa Datos,Lineas Nuevas,,EN PROCESO,18/02/2020 13:55,,,,Brayan - 2020-02-18 13:57:43 - CASA RUSTICA CERCA DEL CAFE TATIAXCA ,,,,
12513006,,1910200236857,Reventa Datos,Lineas Nuevas,,EN PROCESO,18/02/2020 13:54,,,,,,,,
12512967,,1910200236829,Reventa Datos,Lineas Nuevas,,EN PROCESO,18/02/2020 13:44,,,,Brayan - 2020-02-18 13:46:35 - FRENTE A LA VIAS CASA CREMA CON CAFE ,,,,
12512943,,1910200236816,Reventa Datos,Lineas Nuevas,,EN PROCESO,18/02/2020 13:40,,,,,,,,
12512889,,1910200236773,Reventa Datos,Lineas Nuevas,,CREADA/EN PROCESO,18/02/2020 13:25,,18/02/2020 13:58,,,,,,
12512876,,1910200236757,Reventa Datos,Lineas Nuevas,,EN PROCESO,18/02/2020 13:23,,,,,,,,
12512870,,1910200236753,Reventa Datos,Lineas Nuevas,,DOMICILIO SIN FACILIDADES,18/02/2020 13:21,,,,Elizabeth - 2020-02-18 13:44:28 - NA ,,,,
12512853,,1910200236745,Reventa Datos,Lineas Nuevas,,EN PROCESO,18/02/2020 13:19,,,,,,,,
12512792,,1910200236675,Reventa Datos,Lineas Nuevas,,EN PROCESO,18/02/2020 13:02,,,,,,,,
12512768,,1910200236651,Reventa Datos,Lineas Nuevas,,OBJETADA,18/02/2020 12:57,,18/02/2020 13:01,,,,,,
12512740,,1910200236621,Reventa Datos,Lineas Nuevas,,EN PROCESO,18/02/2020 12:50,,,,,,,,
12512735,,1910200236616,Reventa Datos,Lineas Nuevas,,EN PROCESO,18/02/2020 12:49,,,,,,,,
12512698,,1910200236579,Reventa Datos,Lineas Nuevas,,EN PROCESO,18/02/2020 12:39,,,,,,,,
12512644,,1910200236537,Reventa Datos,Lineas Nuevas,,EN PROCESO,18/02/2020 12:31,,,,Brayan - 2020-02-18 12:32:11 - casa de 1 piso ,,,,
12512552,,1910200236469,Reventa Datos,Lineas Nuevas,,EN PROCESO,18/02/2020 12:14,,,,Brayan - 2020-02-18 12:15:24 - A tres cuadras de la hielera tapanatepec pasando el puente casa a mano derecha preguntar por el sr modesto ,,,,
12512550,,1910200236465,Reventa Datos,Lineas Nuevas,,EN PROCESO,18/02/2020 12:14,,,,,,,,
12512539,,1910200236453,Reventa Datos,Lineas Nuevas,,EN PROCESO,18/02/2020 12:12,,,,,,,,
12512529,,1910200236438,Reventa Datos,Lineas Nuevas,,EN PROCESO,18/02/2020 12:09,,,,,,,,
12512526,,1910200236433,Reventa Datos,Lineas Nuevas,,EN PROCESO,18/02/2020 12:07,,,,,,,,
12512511,,1910200236421,Reventa Datos,Lineas Nuevas,,EN PROCESO,18/02/2020 12:04,,,,,,,,
12512465,,1910200236386,Reventa Datos,Lineas Nuevas,,EN PROCESO,18/02/2020 11:57,,,,,,,,
12512404,,1910200236333,Reventa Datos,Lineas Nuevas,,EN PROCESO,18/02/2020 11:44,,,,,,,,
12512342,,1910200236281,Reventa Datos,Lineas Nuevas,,EN PROCESO,18/02/2020 11:30,25/02/2020,,,,,,,
12512315,,1910200236252,Reventa Datos,Lineas Nuevas,,EN PROCESO DE ALTA,18/02/2020 11:23,,18/02/2020 11:26,,Elizabeth - 2020-02-18 11:23:40 - NA ,,,,
12512288,,1910200236230,Reventa Datos,Lineas Nuevas,,EN PROCESO,18/02/2020 11:17,,,,,,,,
12512242,,1910200236191,Reventa Datos,Lineas Nuevas,,EN PROCESO,18/02/2020 11:08,,,,,,,,
12512229,,1910200236180,Reventa Datos,Lineas Nuevas,,EN PROCESO,18/02/2020 11:06,,,,,,,,
12512116,,1910200236146,Reventa Datos,Lineas Nuevas,,EN PROCESO,18/02/2020 10:58,,,,,,,,
12512079,,1910200236116,Reventa Datos,Lineas Nuevas,,EN PROCESO,18/02/2020 10:52,,,,,,,,
12512073,,1910200236101,Reventa Datos,Lineas Nuevas,,EN PROCESO,18/02/2020 10:48,,,,,,,,
12512066,,1910200236092,Reventa Datos,Lineas Nuevas,,EN PROCESO,18/02/2020 10:45,,,,,,,,
12511997,,1910200236030,Reventa Datos,Lineas Nuevas,,EN PROCESO,18/02/2020 10:28,,,,,,,,
12511985,,1910200236011,Reventa Datos,Lineas Nuevas,,OBJETADA,18/02/2020 10:23,,18/02/2020 10:47,,,,,,
12511977,,1910200236001,Reventa Datos,Lineas Nuevas,,EN PROCESO,18/02/2020 10:22,,,,Elizabeth - 2020-02-18 10:24:34 - CERCA DE LA CARRETERA A SALINAS Y COAUTLA ,,,,
12511970,,1910200235995,Reventa Datos,Lineas Nuevas,,OBJETADA,18/02/2020 10:21,,18/02/2020 12:27,,,,,,
12511967,,1910200235986,Reventa Datos,Lineas Nuevas,,EN PROCESO,18/02/2020 10:18,,,,,,,,
12511947,,1910200235971,Reventa Datos,Lineas Nuevas,,EN PROCESO,18/02/2020 10:14,,,,,,,,
12511900,,1910200235938,Reventa Datos,Lineas Nuevas,,EN PROCESO,18/02/2020 10:04,,,,,,,,
12511879,,1910200235917,Reventa Datos,Lineas Nuevas,,EN PROCESO,18/02/2020 09:59,,,,,,,,
12511830,,1910200235879,Reventa Datos,Lineas Nuevas,,EN PROCESO,18/02/2020 09:47,,,,,,,,
12511828,,1910200235877,Reventa Datos,Lineas Nuevas,,EN PROCESO,18/02/2020 09:46,,,,,,,,
12511811,,1910200235863,Reventa Datos,Lineas Nuevas,,EN PROCESO,18/02/2020 09:42,,,,,,,,
12511787,,1910200235847,Reventa Datos,Lineas Nuevas,,EN PROCESO DE ALTA,18/02/2020 09:32,,18/02/2020 09:42,,,,,,
12511774,,1910200235832,Reventa Datos,Lineas Nuevas,,EN PROCESO,18/02/2020 09:25,,,,,,,,
12511765,,1910200235827,Reventa Datos,Lineas Nuevas,,EN PROCESO,18/02/2020 09:22,,,,,,,,
12511743,,1910200235812,Reventa Datos,Lineas Nuevas,,OBJETADA,18/02/2020 09:17,,18/02/2020 13:12,,,,,,
12511737,,1910200235807,Reventa Datos,Lineas Nuevas,,OBJETADA,18/02/2020 09:15,,18/02/2020 09:20,,,,,,
12511719,,1910200235788,Reventa Datos,Lineas Nuevas,,EN PROCESO,18/02/2020 09:06,,,,,,,,
12511707,,1910200235771,Reventa Datos,Lineas Nuevas,,EN PROCESO,18/02/2020 09:00,,,,Elizabeth - 2020-02-18 09:00:42 - NA ,,,,
12511699,,1910200235759,Reventa Datos,Lineas Nuevas,,EN PROCESO,18/02/2020 08:48,,,,,,,,
12511645,,1910200235662,Reventa Datos,Lineas Nuevas,,EN PROCESO,17/02/2020 20:35,,,,Victor - 2020-02-17 20:41:06 - FTE ZONA DEPORTIVA ,,,,
12511588,,1910200235618,Reventa Datos,Suspension,,LIQUIDADA,17/02/2020 19:19,,17/02/2020 19:25,,Victor - 2020-02-17 19:23:47 - SUSPENSION ,,,,
12511585,,1910200235612,Reventa Datos,Suspension,,LIQUIDADA,17/02/2020 19:16,,18/02/2020 09:03,,Victor - 2020-02-17 19:18:55 - SUSPENSION ,,,,
12511581,,1910200235607,Reventa Datos,Suspension,,LIQUIDADA,17/02/2020 19:13,,17/02/2020 19:19,,Victor - 2020-02-17 19:15:54 - SUSPENSION ,,,,
12511578,,1910200235602,Reventa Datos,Suspension,,LIQUIDADA,17/02/2020 19:11,,17/02/2020 19:14,,Victor - 2020-02-17 19:12:57 - SUSPENSION ,,,,
12511576,,1910200235600,Reventa Datos,Lineas Nuevas,,EN PROCESO,17/02/2020 19:09,,,,"Elizabeth - 2020-02-17 19:18:00 - ENTRAR POR LA CALLE CUAHUTEMOC, ESTA UNA IGLESI, Y DOS CUADRAS HACIA ARRIBA, ES CASA CON BARDA DE PIEDRA CASA DE UN SOLO CON UNA LONA AMARIILLA UNI CASA CON LONA AMARILLA. ",,,,
12511575,,1910200235598,Reventa Datos,Suspension,,LIQUIDADA,17/02/2020 19:09,,17/02/2020 19:11,,Victor - 2020-02-17 19:10:12 - SUSPENSION ,,,,
12511549,,1910200235593,Reventa Datos,Suspension,,LIQUIDADA,17/02/2020 19:05,,18/02/2020 08:57,,Victor - 2020-02-17 19:07:24 - SUSPENSION ,,,,
12511542,,1910200235588,Reventa Datos,Suspension,,LIQUIDADA,17/02/2020 19:03,,17/02/2020 19:05,,Victor - 2020-02-17 19:04:40 - SUSPENSION ,,,,
12511470,,1910200235578,Reventa Datos,Suspension,,LIQUIDADA,17/02/2020 18:55,,17/02/2020 18:58,,Victor - 2020-02-17 18:57:49 - SUSPENSION ,,,,
12511459,,1910200235573,Reventa Datos,Suspension,,LIQUIDADA,17/02/2020 18:52,,17/02/2020 19:00,,Victor - 2020-02-17 18:55:04 - SUSPENSION ,,,,
12511451,,1910200235567,Reventa Datos,Suspension,,LIQUIDADA,17/02/2020 18:50,,17/02/2020 18:53,,Victor - 2020-02-17 18:51:44 - SUSPENSION ,,,,
12511387,,1910200235544,Reventa Datos,Suspension,,LIQUIDADA,17/02/2020 18:32,,17/02/2020 18:44,,Victor - 2020-02-17 18:42:32 - SUSPENSION ,,,,
12511381,,1910200235540,Reventa Datos,Suspension,,LIQUIDADA,17/02/2020 18:30,,17/02/2020 18:31,,Victor - 2020-02-17 18:30:55 - SUSPENSION ,,,,
12511267,,1910200235528,Reventa Datos,Suspension,,LIQUIDADA,17/02/2020 18:16,,17/02/2020 18:24,,Victor - 2020-02-17 18:22:31 - SUSPENSION ,,,,
12511215,,1910200235514,Reventa Datos,Suspension,,LIQUIDADA,17/02/2020 18:04,,17/02/2020 18:14,,Victor - 2020-02-17 18:12:04 - SUSPENSION ,,,,
12511200,,1910200235507,Reventa Datos,Suspension,,LIQUIDADA,17/02/2020 17:57,,17/02/2020 18:05,,Victor - 2020-02-17 18:02:34 - SUSPENSION ,,,,
12511187,,1910200235495,Reventa Datos,Suspension,,LIQUIDADA,17/02/2020 17:51,,17/02/2020 17:57,,Victor - 2020-02-17 17:56:27 - SUSPENSION ,,,,
12511160,,1910200235479,Reventa Datos,Suspension,,LIQUIDADA,17/02/2020 17:42,,17/02/2020 17:49,,Victor - 2020-02-17 17:45:30 - SUSPENSION ,,,,
12511121,,1910200235454,Reventa Datos,Suspension,,LIQUIDADA,17/02/2020 17:32,,17/02/2020 17:38,,Victor - 2020-02-17 17:36:24 - SUSPENSION ,,,,
12511033,,1910200235407,Reventa Datos,Suspension,,LIQUIDADA,17/02/2020 17:13,,17/02/2020 17:27,,Victor - 2020-02-17 17:24:52 - SUSPENSION ,,,,
12511005,,1910200235391,Reventa Datos,Suspension,,LIQUIDADA,17/02/2020 17:06,,17/02/2020 17:13,,,,,,
12511001,,1910200235387,Reventa Datos,Suspension,,LIQUIDADA,17/02/2020 17:04,,17/02/2020 17:07,,Victor - 2020-02-17 17:05:06 - SUSPENSION ,,,,
12510986,,1910200235379,Reventa Datos,Lineas Nuevas,,EN PROCESO,17/02/2020 17:02,,,,"Elizabeth - 2020-02-17 17:07:43 - CASA COLOR VERDE UN PISO, SIN NUMERO EXTERIOR, A MEDIA CUADRA SE ENCUENTRA UNA TORTILLERIA ",,,,
12510983,,1910200235373,Reventa Datos,Lineas Nuevas,,EN PROCESO,17/02/2020 17:00,,,,"Elizabeth - 2020-02-17 17:01:26 - CAMINO HACIA EL PANTEON A MANO DERECHA SOBRE LA CALZADA POR AHI CERCAS ESTA UN ACAPILL LA DE LA SAGRADA FAMILIA, CASA CON DOS PERROS, PORTONES BLANCOS Y DOS VENTANAS, AFUERA POR LAS TARDES ESTA UN VOLTEO ZUL, A UN LADO VIVE UNA SE•ORA MUY CONOCIDA POR TOS COMO DO•A BOCHA. ",,,,
12510980,,1910200235370,Reventa Datos,Lineas Nuevas,,EN PROCESO,17/02/2020 17:00,,,,Elizabeth - 2020-02-17 17:18:11 - CENTRO PRENTE A UN GIGNACIO CON NOMBRE GAEL A UN COSTADADO DE UN PORTON NARANGA CASA DE UN PISO SIN PINTAR ,,,,
12510938,,1910200235353,Reventa Datos,Suspension,,LIQUIDADA,17/02/2020 16:48,,17/02/2020 17:54,,Victor - 2020-02-17 16:48:39 - SUSPENSION ,,,,
12510850,,1910200235296,Reventa Datos,Lineas Nuevas,,EN PROCESO,17/02/2020 16:17,,,,Elizabeth - 2020-02-17 16:21:02 - EN FRENTE DE UN DEPOSITO DE CERVEZA ,,,,
12510843,,1910200235286,Reventa Datos,Lineas Nuevas,,EN PROCESO,17/02/2020 16:13,,,,Elizabeth - 2020-02-17 16:15:48 - ESTA CLINIA DEL HOSPILAL ISSTE MORELOS A TRES ANDADORES HACIA EL ORIENTE HACIA LOS REYES PUEDEN ENTRAR POR EL ANDADOR JOSE ANTONIO GALEANA ES UNA CASA DE DOS PLANTAS SIN PINTARR. ,,,,
12510841,,1910200235284,Reventa Datos,Reanudacion,,LIQUIDADA,17/02/2020 16:13,,17/02/2020 17:57,,Victor - 2020-02-17 16:19:52 - REANUDACION ,,,,
12510837,,1910200235274,Reventa Datos,Lineas Nuevas,,EN PROCESO,17/02/2020 16:11,,,,Elizabeth - 2020-02-17 16:30:13 - DEL OXXO DE LAS AMERICAS A UNA CUADRA A LA IZQUIERDA CASA BEIG REGAS NEGRAS UN SOLO PISO ,,,,
12510832,,1910200235264,Reventa Datos,Reanudacion,,LIQUIDADA,17/02/2020 16:07,,17/02/2020 16:14,,Victor - 2020-02-17 16:12:03 - REANUDACION ,,,,
12510829,,1910200235258,Reventa Datos,Lineas Nuevas,,EN PROCESO,17/02/2020 16:04,,,,,,,,
12510828,,1910200235254,Reventa Datos,Reanudacion,,LIQUIDADA,17/02/2020 16:03,,17/02/2020 16:08,,Victor - 2020-02-17 16:06:21 - REANUDACION ,,,,
12510820,,1910200235250,Reventa Datos,Reanudacion,,LIQUIDADA,17/02/2020 16:00,,17/02/2020 16:12,,Victor - 2020-02-17 16:02:48 - REANUDACION ,,,,
12510813,,1910200235243,Reventa Datos,Lineas Nuevas,,EN PROCESO,17/02/2020 15:57,,,,,,,,
12510791,,1910200235215,Reventa Datos,Reanudacion,,LIQUIDADA,17/02/2020 15:47,,17/02/2020 16:02,,Victor - 2020-02-17 15:58:35 - REANUDACION ,,,,
12510790,,1910200235211,Reventa Datos,Reanudacion,,LIQUIDADA,17/02/2020 15:45,,18/02/2020 07:39,,Victor - 2020-02-17 15:46:21 - REANUDACION ,,,,
12510723,,1910200235160,Reventa Datos,Reanudacion,,LIQUIDADA,17/02/2020 15:23,,17/02/2020 17:41,,Victor - 2020-02-17 15:24:30 - REANUDACION ,,,,
12510654,,1910200235103,Reventa Datos,Lineas Nuevas,,OBJETADA,17/02/2020 14:45,,18/02/2020 15:32,,Elizabeth - 2020-02-17 14:46:43 - PERIFERICO R ALMADA A DOS CUADRAS ,,,,
12510640,,1910200235090,Reventa Datos,Lineas Nuevas,,EN PROCESO,17/02/2020 14:39,,,,Juan - 2020-02-17 14:40:30 - DOM JUNTO A UNA CAPILLA O IGLESIA. ,,,,
12510514,,1910200234984,Reventa Datos,Lineas Nuevas,,EN PROCESO,17/02/2020 13:47,,,,,,,,
12510443,,1910200234928,Reventa Datos,Reanudacion,,LIQUIDADA,17/02/2020 13:31,,17/02/2020 13:38,,Ariadna - 2020-02-17 13:34:58 - ACTIVACION ,,,,
12510404,,1910200234917,Reventa Datos,Lineas Nuevas,,EN PROCESO,17/02/2020 13:26,,,,,,,,
12510367,,1910200234895,Reventa Datos,Lineas Nuevas,,EN PROCESO,17/02/2020 13:19,,,,,,,,
12510329,,1910200234864,Reventa Datos,Lineas Nuevas,,EN PROCESO,17/02/2020 13:08,,,,,,,,
12510297,,1910200234834,Reventa Datos,Lineas Nuevas,,EN PROCESO,17/02/2020 13:03,,,,,,,,
12510294,,1910200234831,Reventa Datos,Lineas Nuevas,,EN PROCESO,17/02/2020 13:02,,,,,,,,
12510249,,1910200234801,Reventa Datos,Lineas Nuevas,,EN PROCESO DE ALTA,17/02/2020 12:51,,,,,,,,
12510223,,1910200234783,Reventa Datos,Lineas Nuevas,,EN PROCESO,17/02/2020 12:46,,,,Elizabeth - 2020-02-17 12:47:19 - AL LADO DE CIBER MENDEZ ,,,,
12510175,,1910200234746,Reventa Datos,Lineas Nuevas,,EN PROCESO,17/02/2020 12:37,,,,,,,,
12510155,,1910200234733,Reventa Datos,Lineas Nuevas,,EN PROCESO,17/02/2020 12:34,,,,,,,,
12510111,,1910200234701,Reventa Datos,Lineas Nuevas,,OBJETADA,17/02/2020 12:26,,17/02/2020 12:31,,,,,,
12510086,,1910200234684,Reventa Datos,Lineas Nuevas,,EN PROCESO,17/02/2020 12:20,,,,,,,,
12510065,,1910200234677,Reventa Datos,Lineas Nuevas,,OBJETADA,17/02/2020 12:16,,17/02/2020 12:23,,"Juan - 2020-02-17 12:21:36 - entaria UNICA CASA COLOR NEGRO, ATRAS TERRENO BALDIO Y POR EL TALLER DE LOS CASTILLOS ",,,,
12510057,,1910200234668,Reventa Datos,Lineas Nuevas,,EN PROCESO,17/02/2020 12:15,,,,Elizabeth - 2020-02-17 12:16:26 - FRENTE A UN NEGOCIO DE MIEL ,,,,
12510027,,1910200234642,Reventa Datos,Lineas Nuevas,,EN PROCESO,17/02/2020 12:07,24/02/2020,,,,,,,
12509974,,1910200234593,Reventa Datos,Lineas Nuevas,,EN PROCESO,17/02/2020 11:53,,,,,,,,
12509942,,1910200234582,Reventa Datos,Lineas Nuevas,,OBJETADA,17/02/2020 11:50,,17/02/2020 11:54,,,,,,
12509841,,1910200234505,Reventa Datos,Lineas Nuevas,,EN PROCESO,17/02/2020 11:22,,,,,,,,
12509734,,1910200234458,Reventa Datos,Lineas Nuevas,,EN PROCESO,17/02/2020 11:09,,,,,,,,
12509719,,1910200234447,Reventa Datos,Lineas Nuevas,,EN PROCESO,17/02/2020 11:04,,,,,,,,
12509686,,1910200234414,Reventa Datos,Lineas Nuevas,,EN PROCESO,17/02/2020 10:56,,,,Elizabeth - 2020-02-17 10:57:11 - NA ,,,,
12509682,,1910200234409,Reventa Datos,Lineas Nuevas,,EN PROCESO,17/02/2020 10:55,,,,"Elizabeth - 2020-02-17 10:56:22 - 20.5629581, -100.8645516 ",,,,
12509598,,1910200234370,Reventa Datos,Lineas Nuevas,,EN PROCESO,17/02/2020 10:41,,,,,,,,
12509592,,1910200234363,Reventa Datos,Lineas Nuevas,,EN PROCESO,17/02/2020 10:39,,,,,,,,
12509584,,1910200234354,Reventa Datos,Lineas Nuevas,,EN PROCESO,17/02/2020 10:35,,,,,,,,
12509576,,1910200234336,Reventa Datos,Lineas Nuevas,,EN PROCESO,17/02/2020 10:29,,,,,,,,
12509551,,1910200234323,Reventa Datos,Lineas Nuevas,,EN PROCESO,17/02/2020 10:26,,,,Juan - 2020-02-17 10:28:35 - ESCUELA DEL BARRIO DEL CAMPO A UNA CUADRA ,,,,
12509543,,1910200234316,Reventa Datos,Lineas Nuevas,,EN PROCESO,17/02/2020 10:24,,,,,,,,
12509534,,1910200234308,Reventa Datos,Lineas Nuevas,,EN PROCESO,17/02/2020 10:20,,,,,,,,
12509528,,1910200234302,Reventa Datos,Lineas Nuevas,,EN PROCESO,17/02/2020 10:19,,,,"Elizabeth - 2020-02-17 10:19:50 - EN LA PARTE DE ATRAS ESTA UNA UNIVERCIAD LLAMADA UAT, FRENTE A LA EMPRESA DE LA COCA ESTA LA CALLE QUE SE LLAMA EL CALVARIO QUE ES LA CALLE DONDE SE ENCUENTRA EL DOMICILIO ",,,,
12509519,,1910200234297,Reventa Datos,Reanudacion,,LIQUIDADA,17/02/2020 10:17,,17/02/2020 10:22,,Ariadna - 2020-02-17 10:18:51 - REANUDACION ,,,,
12509485,,1910200234265,Reventa Datos,Lineas Nuevas,,EN PROCESO,17/02/2020 10:01,,,,Elizabeth - 2020-02-17 10:02:13 - CASA DE 2 PLANTAS COLOR CREMA CON PUERTA BLANCA ,,,,
12509395,,1910200234209,Reventa Datos,Lineas Nuevas,,OBJETADA,17/02/2020 09:19,,17/02/2020 10:29,,,,,,
12509382,,1910200234190,Reventa Datos,Lineas Nuevas,,EN PROCESO,17/02/2020 08:58,,,,,,,,
12509337,,1910200234131,Reventa Datos,Lineas Nuevas,,EN PROCESO,16/02/2020 20:12,,,,,,,,
12509336,,1910200234127,Reventa Datos,Lineas Nuevas,,EN PROCESO,16/02/2020 20:05,,,,,,,,
12509333,,1910200234116,Reventa Datos,Lineas Nuevas,,EN PROCESO,16/02/2020 19:39,,,,,,,,
12509332,,1910200234114,Reventa Datos,Lineas Nuevas,,EN PROCESO,16/02/2020 19:39,24/02/2020,,,Elizabeth - 2020-02-16 19:41:06 - es calle cerrada referencia una plaza una fiscal ,,,,
12509313,,1910200234090,Reventa Datos,Lineas Nuevas,,EN PROCESO,16/02/2020 18:57,22/02/2020,,,,,,,
12509303,,1910200234072,Reventa Datos,Lineas Nuevas,,EN PROCESO,16/02/2020 18:19,,,,,,,,
12509300,,1910200234065,Reventa Datos,Lineas Nuevas,,EN PROCESO,16/02/2020 18:03,,,,,,,,
12509294,,1910200234056,Reventa Datos,Lineas Nuevas,,EN PROCESO,16/02/2020 17:44,,,,,,,,
12509290,,1910200234049,Reventa Datos,Lineas Nuevas,,EN PROCESO,16/02/2020 17:36,24/02/2020,,,,,,,
12509287,,1910200234042,Reventa Datos,Lineas Nuevas,,EN PROCESO,16/02/2020 17:14,,,,,,,,
12509286,,1910200234039,Reventa Datos,Lineas Nuevas,,EN PROCESO,16/02/2020 17:05,,,,,,,,
12509284,,1910200234034,Reventa Datos,Lineas Nuevas,,EN PROCESO,16/02/2020 16:54,,,,,,,,
12509281,,1910200234028,Reventa Datos,Reanudacion,,LIQUIDADA,16/02/2020 16:24,,16/02/2020 16:28,,Victor - 2020-02-16 16:27:19 - REANUDACI‡N ,,,,
12509278,,1910200234022,Reventa Datos,Reanudacion,,LIQUIDADA,16/02/2020 16:14,,16/02/2020 16:20,,Ariadna - 2020-02-16 16:16:23 - Reanudaci¢n. ,,,,
12509275,,1910200233999,Reventa Datos,Lineas Nuevas,,EN PROCESO,16/02/2020 15:29,,,,,,,,
12509271,,1910200233991,Reventa Datos,Reanudacion,,LIQUIDADA,16/02/2020 15:06,,16/02/2020 15:10,,Ariadna - 2020-02-16 15:08:46 - Reanudaci¢n ,,,,
12509262,,1910200233959,Reventa Datos,Lineas Nuevas,,EN PROCESO,16/02/2020 14:14,22/02/2020,,,,,,,
12509258,,1910200233948,Reventa Datos,Lineas Nuevas,,EN PROCESO,16/02/2020 14:04,,,,,,,,
12509256,,1910200233946,Reventa Datos,Lineas Nuevas,,EN PROCESO,16/02/2020 14:01,,,,Elizabeth - 2020-02-16 14:02:55 - TORTAS AHOGADAS LA MORENA ,,,,
12509254,,1910200233941,Reventa Datos,Lineas Nuevas,,EN PROCESO,16/02/2020 13:51,,,,,,,,
12509246,,1910200233919,Reventa Datos,Lineas Nuevas,,EN PROCESO,16/02/2020 13:18,,,,,,,,
12509244,,1910200233910,Reventa Datos,Reanudacion,,LIQUIDADA,16/02/2020 13:08,,16/02/2020 13:11,,Ariadna - 2020-02-16 13:09:36 - REANUDACION ,,,,
12509242,,1910200233901,Reventa Datos,Lineas Nuevas,,EN PROCESO,16/02/2020 13:00,,,,,,,,
12509238,,1910200233872,Reventa Datos,Lineas Nuevas,,EN PROCESO,16/02/2020 12:31,,,,,,,,
12509237,,1910200233867,Reventa Datos,Lineas Nuevas,,EN PROCESO,16/02/2020 12:20,,,,Brayan - 2020-02-16 12:24:13 - BENITO JUAREZ 1 FRENTE POZO LOS SAUCES ,,,,
12509233,,1910200233835,Reventa Datos,Lineas Nuevas,,CREADA/EN PROCESO,16/02/2020 11:43,,16/02/2020 11:48,,,,,,
12509231,,1910200233815,Reventa Datos,Lineas Nuevas,,EN PROCESO,16/02/2020 11:26,,,,,,,,
12509227,,1910200233784,Reventa Datos,Lineas Nuevas,,EN PROCESO,16/02/2020 11:03,,,,,,,,
12509224,,1910200233750,Reventa Datos,Lineas Nuevas,,EN PROCESO,16/02/2020 10:23,,,,,,,,
12509223,,1910200233730,Reventa Datos,Lineas Nuevas,,EN PROCESO,16/02/2020 09:56,,,,,,,,
12509222,,1910200233721,Reventa Datos,Lineas Nuevas,,EN PROCESO,16/02/2020 09:28,,,,,,,,
12509206,,1910200233682,Reventa Datos,Lineas Nuevas,,EN PROCESO,15/02/2020 19:59,,,,,,,,
12509197,,1910200233663,Reventa Datos,Lineas Nuevas,,EN PROCESO,15/02/2020 18:43,,,,Elizabeth - 2020-02-15 18:45:22 - CERCA DE PASTELERIA Y PRIMARIA ,,,,
12509193,,1910200233646,Reventa Datos,Lineas Nuevas,,EN PROCESO,15/02/2020 18:05,,,,,,,,
12509180,,1910200233565,Reventa Datos,Lineas Nuevas,,EN PROCESO,15/02/2020 16:20,26/02/2020,,,,,,,
12509159,,1910200233453,Reventa Datos,Lineas Nuevas,,OBJETADA,15/02/2020 14:34,,15/02/2020 14:36,,,,,,
12509150,,1910200233421,Reventa Datos,Lineas Nuevas,,EN PROCESO,15/02/2020 14:20,,,,"Elizabeth - 2020-02-15 14:21:07 - ESTA UNA TIENDA EN LA ESQUINA Y ESTA OTRA TIENDA EN EN LA BASILIO VADILLO, ESTA EL DOMICILIO EN MEDIO DE LAS DOS TIENDAS ",,,,
12509145,,1910200233406,Reventa Datos,Lineas Nuevas,,OBJETADA,15/02/2020 14:10,,15/02/2020 14:13,,Elizabeth - 2020-02-15 14:11:15 - LA CASA ESTA AUN COSTADO DELA TIENDA MICELANEA JUREZ ,,,,
12509141,,1910200233385,Reventa Datos,Lineas Nuevas,,EN PROCESO,15/02/2020 13:59,22/02/2020,,,,,,,
12509140,,1910200233383,Reventa Datos,Lineas Nuevas,,OBJETADA,15/02/2020 13:59,,15/02/2020 14:09,,Elizabeth - 2020-02-15 14:07:42 - LA CASA ESTA AUN COSTADO DELA TIENDA MICELANEA JUREZ ,,,,
12509116,,1910200233227,Reventa Datos,Lineas Nuevas,,EN PROCESO,15/02/2020 13:08,,,,,,,,
12509113,,1910200233206,Reventa Datos,Lineas Nuevas,,EN PROCESO,15/02/2020 13:03,,,,,,,,
12509111,,1910200233189,Reventa Datos,Lineas Nuevas,,EN PROCESO,15/02/2020 12:58,,,,"Elizabeth - 2020-02-15 12:59:41 - REFERENCIA BODEGA AURRERA A UNA CUADRA, MAS ADELANTE TIENDA GRAN BODEGA ",,,,
12509103,,1910200233149,Reventa Datos,Lineas Nuevas,,EN PROCESO DE ALTA,15/02/2020 12:47,,,,,,,,
12509097,,1910200233124,Reventa Datos,Lineas Nuevas,,EN PROCESO,15/02/2020 12:40,,,,"Elizabeth - 2020-02-15 12:40:41 - FRENTE AL KINDER, A 30 METROS DE LOS BOMBEROS ",,,,
12509096,,1910200233122,Reventa Datos,Lineas Nuevas,,EN PROCESO,15/02/2020 12:38,,,,,,,,
12509092,,1910200233100,Reventa Datos,Lineas Nuevas,,EN PROCESO,15/02/2020 12:28,,,,,,,,
12509090,,1910200233093,Reventa Datos,Lineas Nuevas,,EN PROCESO,15/02/2020 12:25,,,,,,,,
12509088,,1910200233089,Reventa Datos,Lineas Nuevas,,EN PROCESO,15/02/2020 12:24,,,,,,,,
12509084,,1910200233073,Reventa Datos,Lineas Nuevas,,EN PROCESO,15/02/2020 12:18,,,,,,,,
12509078,,1910200233044,Reventa Datos,Lineas Nuevas,,EN PROCESO,15/02/2020 12:08,,,,,,,,
12509073,,1910200233022,Reventa Datos,Lineas Nuevas,,EN PROCESO,15/02/2020 11:57,,,,,,,,
12509070,,1910200233005,Reventa Datos,Reanudacion,,LIQUIDADA,15/02/2020 11:49,,15/02/2020 11:52,,Ariadna - 2020-02-15 11:50:43 - ACTIVACION ,,,,
12509064,,1910200232975,Reventa Datos,Lineas Nuevas,,EN PROCESO,15/02/2020 11:41,,,,,,,,
12509057,,1910200232934,Reventa Datos,Lineas Nuevas,,EN PROCESO,15/02/2020 11:31,,,,,,,,
12509056,,1910200232931,Reventa Datos,Lineas Nuevas,,EN PROCESO,15/02/2020 11:30,,,,,,,,
12509053,,1910200232918,Reventa Datos,Lineas Nuevas,,EN PROCESO,15/02/2020 11:25,,,,,,,,
12509052,,1910200232909,Reventa Datos,Lineas Nuevas,,EN PROCESO,15/02/2020 11:23,,,,,,,,
12509050,,1910200232887,Reventa Datos,Lineas Nuevas,,EN PROCESO,15/02/2020 11:18,,,,Elizabeth - 2020-02-15 11:19:33 - NA ,,,,
12509043,,1910200232850,Reventa Datos,Lineas Nuevas,,EN PROCESO,15/02/2020 11:06,,,,,,,,
12509033,,1910200232785,Reventa Datos,Lineas Nuevas,,EN PROCESO,15/02/2020 10:39,,,,,,,,
12509031,,1910200232766,Reventa Datos,Lineas Nuevas,,OBJETADA,15/02/2020 10:31,,15/02/2020 10:34,,,,,,
12509026,,1910200232755,Reventa Datos,Lineas Nuevas,,DOMICILIO SIN FACILIDADES,15/02/2020 10:24,,,,,,,,
12509023,,1910200232738,Reventa Datos,Lineas Nuevas,,EN PROCESO,15/02/2020 10:15,,,,,,,,
12509014,,1910200232701,Reventa Datos,Lineas Nuevas,,EN PROCESO,15/02/2020 10:03,21/02/2020,,,,,,,
12509013,,1910200232696,Reventa Datos,Lineas Nuevas,,EN PROCESO,15/02/2020 10:02,,,,Elizabeth - 2020-02-15 10:02:55 - NA ,,,,
12509010,,1910200232678,Reventa Datos,Lineas Nuevas,,EN PROCESO,15/02/2020 09:56,,,,,,,,
12509001,,1910200232642,Reventa Datos,Lineas Nuevas,,EN PROCESO,15/02/2020 09:39,,,,,,,,
12508998,,1910200232628,Reventa Datos,Lineas Nuevas,,EN PROCESO,15/02/2020 09:33,,,,,,,,
12508988,,1910200232590,Reventa Datos,Lineas Nuevas,,EN PROCESO,15/02/2020 09:07,,,,,,,,
12508849,,1910200232477,Reventa Datos,Lineas Nuevas,,EN PROCESO,14/02/2020 19:49,,,,,,,,
12508843,,1910200232465,Reventa Datos,Lineas Nuevas,,EN PROCESO,14/02/2020 19:43,,,,,,,,
12508824,,1910200232442,Reventa Datos,Lineas Nuevas,,EN PROCESO,14/02/2020 19:30,20/02/2020,,,,,,,
12508822,,1910200232438,Reventa Datos,Lineas Nuevas,,DOMICILIO SIN FACILIDADES,14/02/2020 19:30,,,,,,,,
12508779,,1910200232421,Reventa Datos,Lineas Nuevas,,EN PROCESO,14/02/2020 19:17,,,,,,,,
12508768,,1910200232416,Reventa Datos,Lineas Nuevas,,EN PROCESO,14/02/2020 19:12,20/02/2020,,,,,,,
12508739,,1910200232398,Reventa Datos,Lineas Nuevas,,EN PROCESO,14/02/2020 19:00,,,,,,,,
12508737,,1910200232394,Reventa Datos,Lineas Nuevas,,EN PROCESO,14/02/2020 18:59,,,,Victor - 2020-02-14 19:23:56 - FRENTE AL OXXO ,,,,
12508730,,1910200232386,Reventa Datos,Lineas Nuevas,,EN PROCESO,14/02/2020 18:56,,,,"Elizabeth - 2020-02-14 18:58:53 - CASA COLOR AMARILLA, UN PISO ",,,,
12508718,,1910200232378,Reventa Datos,Lineas Nuevas,,EN PROCESO,14/02/2020 18:51,,,,Victor - 2020-02-14 18:52:03 - CASA DE DOS PISOS COLOR BLANCO ,,,,
12508705,,1910200232364,Reventa Datos,Lineas Nuevas,,EN PROCESO,14/02/2020 18:45,,,,Elizabeth - 2020-02-14 18:46:00 - AV INDEPENDENCIA ESTA EN LA ESQUINA UNA LA TORLLERIA A 3 CASA ,,,,
12508703,,1910200232361,Reventa Datos,Lineas Nuevas,,EN PROCESO,14/02/2020 18:44,,,,,,,,
12508667,,1910200232340,Reventa Datos,Lineas Nuevas,,EN PROCESO,14/02/2020 18:33,,,,Elizabeth - 2020-02-14 18:34:01 - OK XD ,,,,
12508662,,1910200232335,Reventa Datos,Lineas Nuevas,,EN PROCESO,14/02/2020 18:29,,,,"Elizabeth - 2020-02-14 18:37:04 - CASA COLOR MELON, PORTON VERDE CON AMARILLO EN UN AEZQUINA DE UN RESTAURANTE ",,,,
12508658,,1910200232329,Reventa Datos,Lineas Nuevas,,EN PROCESO,14/02/2020 18:27,,,,,,,,
12508629,,1910200232315,Reventa Datos,Lineas Nuevas,,EN PROCESO,14/02/2020 18:20,,,,"Elizabeth - 2020-02-14 18:26:46 - CASA DE DOS PALNTAS, A LADO DE UNA TIENDA DE ABARROTES ""CARINA"". ",,,,
12508627,,1910200232313,Reventa Datos,Lineas Nuevas,,EN PROCESO,14/02/2020 18:19,,,,,,,,
12508609,,1910200232295,Reventa Datos,Lineas Nuevas,,EN PROCESO,14/02/2020 18:13,,,,,,,,
12508601,,1910200232287,Reventa Datos,Lineas Nuevas,,EN PROCESO,14/02/2020 18:10,20/02/2020,,,,,,,
12508557,,1910200232246,Reventa Datos,Lineas Nuevas,,EN PROCESO,14/02/2020 17:53,,,,,,,,
12508552,,1910200232244,Reventa Datos,Lineas Nuevas,,EN PROCESO,14/02/2020 17:52,,,,Elizabeth - 2020-02-14 17:55:14 - CASA EN LA ESQUINA CON PUERTA AZUL OK XD ,,,,
12508539,,1910200232230,Reventa Datos,Lineas Nuevas,,EN PROCESO,14/02/2020 17:46,,,,,,,,
12508516,,1910200232203,Reventa Datos,Lineas Nuevas,,EN PROCESO,14/02/2020 17:37,,,,,,,,
12508515,,1910200232201,Reventa Datos,Lineas Nuevas,,EN PROCESO,14/02/2020 17:36,21/02/2020,,,"Elizabeth - 2020-02-14 17:39:28 - CERCO NEGRO, A ESPALDAS FARMACIA SIMILARES OK XD ",,,,
12508511,,1910200232197,Reventa Datos,Lineas Nuevas,,EN PROCESO,14/02/2020 17:34,,,,,,,,
12508504,,1910200232189,Reventa Datos,Lineas Nuevas,,EN PROCESO,14/02/2020 17:29,,,,,,,,
12508490,,1910200232168,Reventa Datos,Lineas Nuevas,,EN PROCESO,14/02/2020 17:21,,,,"Elizabeth - 2020-02-14 17:22:47 - Casa de ladrillo, a un costado del un v†lido. ",,,,
12508464,,1910200232151,Reventa Datos,Lineas Nuevas,,EN PROCESO,14/02/2020 17:13,,,,,,,,
12508460,,1910200232145,Reventa Datos,Lineas Nuevas,,EN PROCESO,14/02/2020 17:12,,,,,,,,
12508453,,1910200232140,Reventa Datos,Lineas Nuevas,,EN PROCESO,14/02/2020 17:07,,,,,,,,
12508451,,1910200232137,Reventa Datos,Lineas Nuevas,,EN PROCESO,14/02/2020 17:06,,,,,,,,
12508405,,1910200232095,Reventa Datos,Lineas Nuevas,,EN PROCESO,14/02/2020 16:50,,,,,,,,
12508403,,1910200232091,Reventa Datos,Lineas Nuevas,,EN PROCESO,14/02/2020 16:50,,,,Elizabeth - 2020-02-14 16:50:48 - OK XD ,,,,
12508398,,1910200232083,Reventa Datos,Suspension,,LIQUIDADA,14/02/2020 16:48,,14/02/2020 16:50,,Victor - 2020-02-14 16:49:30 - SUSPENSION ,,,,
12508395,,1910200232073,Reventa Datos,Lineas Nuevas,,EN PROCESO,14/02/2020 16:46,22/02/2020,,,,,,,
12508394,,1910200232066,Reventa Datos,Lineas Nuevas,,EN PROCESO,14/02/2020 16:43,,,,,,,,
12508389,,1910200232063,Reventa Datos,Suspension,,LIQUIDADA,14/02/2020 16:42,,14/02/2020 16:47,,Victor - 2020-02-14 16:45:12 - SUSPENSION ,,,,
12508385,,1910200232060,Reventa Datos,Lineas Nuevas,,EN PROCESO,14/02/2020 16:39,,,,Elizabeth - 2020-02-14 17:05:05 - Casa de dos niveles zagu†n verde ,,,,
12508375,,1910200232045,Reventa Datos,Suspension,,LIQUIDADA,14/02/2020 16:36,,14/02/2020 16:43,,Victor - 2020-02-14 16:40:57 - SUSPENSION ,,,,
12508371,,1910200232038,Reventa Datos,Suspension,,LIQUIDADA,14/02/2020 16:34,,14/02/2020 16:35,,Victor - 2020-02-14 16:35:06 - SUSPENSION ,,,,
12508370,,1910200232032,Reventa Datos,Lineas Nuevas,,EN PROCESO,14/02/2020 16:32,,,,,,,,
12508363,,1910200232026,Reventa Datos,Suspension,,LIQUIDADA,14/02/2020 16:30,,14/02/2020 16:36,,Victor - 2020-02-14 16:31:06 - SUSPENSION ,,,,
12508356,,1910200232020,Reventa Datos,Lineas Nuevas,,EN PROCESO,14/02/2020 16:29,,,,"Elizabeth - 2020-02-14 16:39:29 - CASA BLANCA CON ROJO, SE ENCUENTRA UN SIX ENFRENTE DE EL DOMICILIO. ",,,,
12508346,,1910200232011,Reventa Datos,Suspension,,LIQUIDADA,14/02/2020 16:23,,14/02/2020 16:28,,Victor - 2020-02-14 16:27:27 - SUSPENSION ,,,,
12508344,,1910200232009,Reventa Datos,Lineas Nuevas,,EN PROCESO,14/02/2020 16:23,,,,,,,,
12508337,,1910200232002,Reventa Datos,Suspension,,LIQUIDADA,14/02/2020 16:20,,14/02/2020 16:23,,Victor - 2020-02-14 16:22:21 - SUSPENSION ,,,,
12508336,,1910200232000,Reventa Datos,Lineas Nuevas,,EN PROCESO,14/02/2020 16:19,,,,,,,,
12508334,,1910200231997,Reventa Datos,Lineas Nuevas,,OBJETADA,14/02/2020 16:19,,20/02/2020 10:46,,"Marian - 2020-02-20 10:42:44 - Se objeta solicitud ,tecnico CS ?no acudio. ",,,,
12508328,,1910200231984,Reventa Datos,Lineas Nuevas,,EN PROCESO,14/02/2020 16:15,,,,,,,,
12508321,,1910200231974,Reventa Datos,Reanudacion,,LIQUIDADA,14/02/2020 16:11,,14/02/2020 16:16,,Victor - 2020-02-14 16:14:04 - REANUDACION ,,,,
12508311,,1910200231965,Reventa Datos,Lineas Nuevas,,LIQUIDADA,14/02/2020 16:05,,20/02/2020 12:06,,,,,,
12508309,,1910200231963,Reventa Datos,Reanudacion,,LIQUIDADA,14/02/2020 16:05,,14/02/2020 16:18,,Victor - 2020-02-14 16:10:27 - REANUDACION ,,,,
12508300,,1910200231958,Reventa Datos,Lineas Nuevas,,EN PROCESO,14/02/2020 16:03,,,,,,,,
12508297,,1910200231953,Reventa Datos,Reanudacion,,LIQUIDADA,14/02/2020 16:00,,14/02/2020 16:06,,Victor - 2020-02-14 16:04:20 - REANUDACION ,,,,
12508248,,1910200231858,Reventa Datos,Lineas Nuevas,,EN PROCESO,14/02/2020 14:57,,,,Elizabeth - 2020-02-14 16:41:54 - OK XD ,,,,
12508226,,1910200231821,Reventa Datos,Lineas Nuevas,,EN PROCESO DE ALTA,14/02/2020 14:36,,14/02/2020 14:44,,,,,,
12508162,,1910200231755,Reventa Datos,Lineas Nuevas,,EN PROCESO DE ALTA,14/02/2020 14:06,,14/02/2020 14:18,,,,,,
12508118,,1910200231704,Reventa Datos,Lineas Nuevas,,OBJETADA,14/02/2020 13:48,,20/02/2020 11:36,,,,,,
12508069,,1910200231667,Reventa Datos,Lineas Nuevas,,EN PROCESO,14/02/2020 13:36,,,,,,,,
12508064,,1910200231659,Reventa Datos,Lineas Nuevas,,EN PROCESO,14/02/2020 13:35,,,,,,,,
12508028,,1910200231616,Reventa Datos,Lineas Nuevas,,EN PROCESO,14/02/2020 13:22,,,,,,,,
12508025,,1910200231610,Reventa Datos,Lineas Nuevas,,OBJETADA,14/02/2020 13:21,,17/02/2020 10:20,,Elizabeth - 2020-02-14 13:22:09 - CASA DE DOS PISOS PORTON NEGRO CERCA DE LA VIA ,,,,
12508015,,1910200231604,Reventa Datos,Lineas Nuevas,,OBJETADA,14/02/2020 13:17,,20/02/2020 11:36,,,,,,
12507982,,1910200231567,Reventa Datos,Lineas Nuevas,,EN PROCESO,14/02/2020 13:06,,,,,,,,
12507919,,1910200231522,Reventa Datos,Lineas Nuevas,,EN PROCESO,14/02/2020 12:50,,,,,,,,
12507890,,1910200231505,Reventa Datos,Lineas Nuevas,,EN PROCESO,14/02/2020 12:40,,,,,,,,
12507881,,1910200231494,Reventa Datos,Lineas Nuevas,,EN PROCESO,14/02/2020 12:37,,,,,,,,
12507861,,1910200231490,Reventa Datos,Lineas Nuevas,,EN PROCESO,14/02/2020 12:34,,,,Brayan - 2020-02-14 12:35:21 - FRENTE AREA VERDE ,,,,
12507688,,1910200231383,Reventa Datos,Lineas Nuevas,,EN PROCESO,14/02/2020 11:51,,,,Juan - 2020-02-14 11:52:10 - A 3 KM DEL AEROPUERTO DE MORELIA ,,,,
12507648,,1910200231333,Reventa Datos,Lineas Nuevas,,EN PROCESO,14/02/2020 11:41,,,,"Marian - 2020-02-20 10:12:50 - Se objeta solicitud, tecnico CS?no acudio. ",,,,
12507614,,1910200231285,Reventa Datos,Lineas Nuevas,,EN PROCESO,14/02/2020 11:30,,,,,,,,
12507598,,1910200231252,Reventa Datos,Lineas Nuevas,,EN PROCESO,14/02/2020 11:22,,,,,,,,
12507438,,1910200231210,Reventa Datos,Lineas Nuevas,,EN PROCESO,14/02/2020 11:11,,,,,,,,
12507417,,1910200231181,Reventa Datos,Lineas Nuevas,,EN PROCESO,14/02/2020 11:00,,,,,,,,
12507397,,1910200231154,Reventa Datos,Lineas Nuevas,,EN PROCESO,14/02/2020 10:52,,,,"Guadalupe - 2020-02-14 10:54:24 - : HAY UNA CAMINOETA NEGRA Y UN CARRO GRIS AFUERA DE DOMICILIO : EN LA ENTRADA HAY OFICINAS : TAMBIEN EL DOMICILIO AFUERA DE FRACIONAMIENTO HAY UN A IGLECIA "" LEON DE JUDA"" ",,,,
12507381,,1910200231136,Reventa Paquetes,Desagrega linea existente,,EN PROCESO,14/02/2020 10:47,,,,Maricarmen - 2020-02-15 10:28:21 - Se objeta solicitud cliente no desea el servicio a petici?n de CS Carlos Buenrostro. Elizabeth - 2020-02-14 10:52:06 - alta de linea existente ,,,,
12507235,,1910200231084,Reventa Datos,Lineas Nuevas,,EN PROCESO,14/02/2020 10:34,,,,,,,,
12507045,,1910200231049,Reventa Datos,Lineas Nuevas,,OBJETADA,14/02/2020 10:24,,20/02/2020 11:14,,,,,,
12507011,,1910200230993,Reventa Datos,Lineas Nuevas,,EN PROCESO,14/02/2020 10:09,,,,,,,,
12506993,,1910200230968,Reventa Datos,Lineas Nuevas,,EN PROCESO,14/02/2020 10:00,,,,,,,,
12506888,,1910200230919,Reventa Datos,Lineas Nuevas,,EN PROCESO,14/02/2020 09:39,,,,"Guadalupe - 2020-02-14 09:52:19 - CASA DE DOS PLANTAS : MORADA O LILA BARANDAL BLANCO FRENTE A "" HR INDUSTRIAL SOBRE CALLE 15"" Y UN MECANICO ENGENERAL : Y HA 4 CUADRAS JARDIN DE NI•OS "" MEXICO 91 "" Y HA 8 CUADRAS DE ESCUELA SECUNDARIA "" 7 FUENTES MARES "" ",,,,
12506886,,1910200230916,Reventa Datos,Lineas Nuevas,,EN PROCESO,14/02/2020 09:37,,,,,,,,
12506885,,1910200230912,Reventa Datos,Lineas Nuevas,,EN PROCESO,14/02/2020 09:35,,,,,,,,
12506783,,1910200230883,Reventa Datos,Lineas Nuevas,,CREADA/EN PROCESO,14/02/2020 09:16,,14/02/2020 10:28,,,,,,
12506780,,1910200230878,Reventa Datos,Lineas Nuevas,,EN PROCESO,14/02/2020 09:14,,,,Elizabeth - 2020-02-14 09:18:44 - Elizabeth - 2020-02-14 09:18:42 - NA ,,,,
12506698,,1910200230847,Reventa Datos,Lineas Nuevas,,EN PROCESO,14/02/2020 07:42,,,,,,,,
12506645,,1910200230797,Reventa Datos,Lineas Nuevas,,EN PROCESO,13/02/2020 20:26,,,,,,,,
12506640,,1910200230789,Reventa Datos,Lineas Nuevas,,EN PROCESO,13/02/2020 20:19,,,,,,,,
12506639,,1910200230785,Reventa Datos,Lineas Nuevas,,OBJETADA,13/02/2020 20:19,,20/02/2020 11:38,,Elizabeth - 2020-02-13 20:19:55 - O XD ,,,,
12506630,,1910200230769,Reventa Datos,Lineas Nuevas,,EN PROCESO,13/02/2020 20:11,,,,Elizabeth - 2020-02-13 20:12:15 - ,,,,
12506615,,1910200230733,Reventa Datos,Lineas Nuevas,,EN PROCESO,13/02/2020 19:54,,,,,,,,
12506613,,1910200230731,Reventa Datos,Lineas Nuevas,,CREADA/EN PROCESO,13/02/2020 19:53,,13/02/2020 19:57,,"Elizabeth - 2020-02-13 19:54:25 - CASA 2 NIVELES TABIQUE ROJO, PUERTA NEGRA ULTIMA CASA DE LA CERRADA A LA DERECHA. OK XD ",,,,
12506605,,1910200230713,Reventa Datos,Lineas Nuevas,,OBJETADA,13/02/2020 19:49,,13/02/2020 19:54,,,,,,
12506603,,1910200230709,Reventa Datos,Lineas Nuevas,,OBJETADA,13/02/2020 19:47,,13/02/2020 20:25,,"Elizabeth - 2020-02-13 19:48:39 - CASA 2 NIVELES TABIQUE ROJO, PUERTA NEGRA ULTIMA CASA DE LA CERRADA A LA DERECHA. OK XD ",,,,
12506602,,1910200230704,Reventa Datos,Lineas Nuevas,,EN PROCESO,13/02/2020 19:45,,,,,,,,
12506601,,1910200230698,Reventa Datos,Lineas Nuevas,,EN PROCESO,13/02/2020 19:43,,,,,,,,
12506599,,1910200230686,Reventa Datos,Lineas Nuevas,,EN PROCESO,13/02/2020 19:40,,,,Elizabeth - 2020-02-13 19:41:32 - CASA DE UN PISO COLOR AMARILLO OK XD ,,,,
12506598,,1910200230684,Reventa Datos,Lineas Nuevas,,EN PROCESO,13/02/2020 19:39,,,,,,,,
12506596,,1910200230682,Reventa Datos,Lineas Nuevas,,OBJETADA,13/02/2020 19:37,,20/02/2020 10:46,,"Marian - 2020-02-20 10:40:35 - Se objeta solicitud, tecnico CS no?acudio. ",,,,
12506594,,1910200230675,Reventa Datos,Lineas Nuevas,,EN PROCESO,13/02/2020 19:35,,,,Elizabeth - 2020-02-13 19:36:07 - CASA 1 PISO SIN PINTAR EN LA ESQUINA TIENDA DE ABARROTES. OK XD ,,,,
12506591,,1910200230665,Reventa Datos,Lineas Nuevas,,EN PROCESO,13/02/2020 19:27,,,,,,,,
12506588,,1910200230661,Reventa Datos,Lineas Nuevas,,EN PROCESO,13/02/2020 19:25,,,,,,,,
12506584,,1910200230649,Reventa Datos,Lineas Nuevas,,EN PROCESO,13/02/2020 19:21,,,,,,,,
12506579,,1910200230636,Reventa Datos,Lineas Nuevas,,EN PROCESO,13/02/2020 19:15,,,,,,,,
12506542,,1910200230619,Reventa Datos,Lineas Nuevas,,EN PROCESO,13/02/2020 19:01,,,,"Elizabeth - 2020-02-13 19:02:54 - CASA DE UN NIVEL COLOR GRIS,ZAHUAN DE REJA OK XD ",,,,
12506530,,1910200230615,Reventa Datos,Lineas Nuevas,,EN PROCESO,13/02/2020 18:58,,,,,,,,
12506525,,1910200230611,Reventa Datos,Suspension,,LIQUIDADA,13/02/2020 18:56,,13/02/2020 21:10,,Victor - 2020-02-13 19:00:13 - SUSPENSION ,,,,
12506522,,1910200230608,Reventa Datos,Lineas Nuevas,,EN PROCESO,13/02/2020 18:55,,,,,,,,
12506516,,1910200230601,Reventa Datos,Suspension,,LIQUIDADA,13/02/2020 18:52,,13/02/2020 20:30,,Victor - 2020-02-13 18:55:41 - SUSPENSION ,,,,
12506512,,1910200230599,Reventa Datos,Lineas Nuevas,,EN PROCESO,13/02/2020 18:51,,,,,,,,
12506505,,1910200230594,Reventa Datos,Suspension,,LIQUIDADA,13/02/2020 18:49,,13/02/2020 21:09,,Victor - 2020-02-13 18:51:42 - SUSPENSION ,,,,
12506497,,1910200230587,Reventa Datos,Lineas Nuevas,,OBJETADA,13/02/2020 18:46,,16/02/2020 13:20,,Elizabeth - 2020-02-13 18:47:55 - CASA AMARILLA OK XD ,,,,
12506496,,1910200230585,Reventa Datos,Suspension,,LIQUIDADA,13/02/2020 18:46,,13/02/2020 21:09,,Victor - 2020-02-13 18:48:58 - SUSPENSION ,,,,
12506495,,1910200230584,Reventa Datos,Lineas Nuevas,,EN PROCESO,13/02/2020 18:46,,,,,,,,
12506487,,1910200230577,Reventa Datos,Suspension,,CREADA / EN PROCESO,13/02/2020 18:45,,,,Victor - 2020-02-13 18:46:12 - SUSPENSION ,,,,
12506461,,1910200230559,Reventa Datos,Lineas Nuevas,,EN PROCESO,13/02/2020 18:39,,,,Elizabeth - 2020-02-13 18:40:45 - CASA DE COLOR CAFE UN NIVEL PUERTA NEGRA OK XD ,,,,
12506452,,1910200230552,Reventa Datos,Suspension,,CREADA / EN PROCESO,13/02/2020 18:36,,,,Victor - 2020-02-13 18:42:17 - SUSPENSION ,,,,
12506444,,1910200230538,Reventa Datos,Suspension,,LIQUIDADA,13/02/2020 18:33,,13/02/2020 21:06,,Victor - 2020-02-13 18:35:55 - SUSPENSION ,,,,
12506437,,1910200230532,Reventa Datos,Suspension,,CREADA / EN PROCESO,13/02/2020 18:30,,,,Victor - 2020-02-13 18:31:49 - SUSPENSION ,,,,
12506392,,1910200230526,Reventa Datos,Suspension,,LIQUIDADA,13/02/2020 18:27,,13/02/2020 21:06,,Victor - 2020-02-13 18:29:04 - SUSPENSION ,,,,
12506385,,1910200230523,Reventa Datos,Lineas Nuevas,,EN PROCESO,13/02/2020 18:25,,,,,,,,
12506384,,1910200230521,Reventa Datos,Suspension,,LIQUIDADA,13/02/2020 18:25,,13/02/2020 21:05,,Victor - 2020-02-13 18:26:13 - SUSPENSION ,,,,
12506360,,1910200230516,Reventa Datos,Suspension,,LIQUIDADA,13/02/2020 18:20,,13/02/2020 21:09,,Victor - 2020-02-13 18:22:43 - SUSPENSION ,,,,
12506350,,1910200230496,Reventa Datos,Lineas Nuevas,,EN PROCESO,13/02/2020 18:12,,,,,,,,
12506347,,1910200230490,Reventa Datos,Suspension,,CREADA / EN PROCESO,13/02/2020 18:11,,,,Victor - 2020-02-13 18:19:51 - SUSPENSION ,,,,
12506344,,1910200230486,Reventa Datos,Suspension,,CREADA / EN PROCESO,13/02/2020 18:09,,,,Victor - 2020-02-13 18:10:31 - SUSPENSION ,,,,
12506333,,1910200230478,Reventa Datos,Lineas Nuevas,,OBJETADA,13/02/2020 18:03,,20/02/2020 10:17,,,,,,
12506331,,1910200230473,Reventa Datos,Lineas Nuevas,,OBJETADA,13/02/2020 18:02,19/02/2020,19/02/2020 14:45,,,,,,
12506326,,1910200230462,Reventa Datos,Suspension,,LIQUIDADA,13/02/2020 17:56,,14/02/2020 12:06,,Victor - 2020-02-13 17:58:52 - SUSPENSION ,,,,
12506323,,1910200230456,Reventa Datos,Lineas Nuevas,,EN PROCESO,13/02/2020 17:55,,,,,,,,
12506321,,1910200230451,Reventa Datos,Lineas Nuevas,,CREADA/EN PROCESO,13/02/2020 17:55,,13/02/2020 18:29,,Elizabeth - 2020-02-13 18:24:13 - FACHADA BLANCA CON AMARILLO OK XD ,,,,
12506318,,1910200230445,Reventa Datos,Lineas Nuevas,,EN PROCESO,13/02/2020 17:53,,,,,,,,
12506303,,1910200230425,Reventa Datos,Lineas Nuevas,,OBJETADA,13/02/2020 17:46,,20/02/2020 10:43,,Elizabeth - 2020-02-13 17:47:23 - OK XD ,,,,
12506283,,1910200230419,Reventa Datos,Lineas Nuevas,,EN PROCESO,13/02/2020 17:45,,,,,,,,
12506245,,1910200230401,Reventa Datos,Lineas Nuevas,,EN PROCESO,13/02/2020 17:33,,,,,,,,
12506236,,1910200230395,Reventa Datos,Lineas Nuevas,,EN PROCESO,13/02/2020 17:30,,,,"Elizabeth - 2020-02-13 17:30:59 - CERCAS DEL DOM. SE ENCUENTRA UNA ESCUELA DE JARDIN DE NI•OS ""LUZ MARIA"" ",,,,
12506231,,1910200230388,Reventa Datos,Suspension,,LIQUIDADA,13/02/2020 17:28,,13/02/2020 20:30,,Victor - 2020-02-13 17:28:45 - SUSPENSION ,,,,
12506189,,1910200230344,Reventa Datos,Lineas Nuevas,,EN PROCESO,13/02/2020 17:18,,,,Elizabeth - 2020-02-13 17:19:23 - LA ENTRADA DEPOSITO DE AGUA ODAPAZ CASA FACHADA DE TABIQUE ,,,,
12506145,,1910200230298,Reventa Datos,Lineas Nuevas,,OBJETADA,13/02/2020 17:01,,20/02/2020 09:09,,"Marian - 2020-02-20 09:10:01 - Se objeta solicitud ,tecnico CS ?no acudio. Elizabeth - 2020-02-13 17:25:15 - OK XD ",,,,
12506136,,1910200230286,Reventa Datos,Lineas Nuevas,,EN PROCESO,13/02/2020 16:59,,,,"Elizabeth - 2020-02-13 17:00:10 - ES UN LOCAL QUE SE ENCUENTRA A UN LADO DE UNA VINATERIA LLAMADA ""VINOS Y LICORES DIEGO GAEL"" ",,,,
12506121,,1910200230269,Reventa Datos,Lineas Nuevas,,EN PROCESO,13/02/2020 16:54,,,,Elizabeth - 2020-02-13 16:54:50 - A LADO DE COCINA LILIS OK XD ,,,,
12506120,,1910200230267,Reventa Datos,Lineas Nuevas,,EN PROCESO,13/02/2020 16:53,,,,Victor - 2020-02-13 16:54:13 - ,,,,
12506119,,1910200230265,Reventa Datos,Suspension,,LIQUIDADA,13/02/2020 16:53,,13/02/2020 21:06,,Victor - 2020-02-13 16:54:15 - SUSPENSION ,,,,
12506090,,1910200230237,Reventa Datos,Suspension,,CREADA / EN PROCESO,13/02/2020 16:44,,,,Victor - 2020-02-13 16:44:51 - SUSPENSION ,,,,
12506082,,1910200230226,Reventa Datos,Reanudacion,,LIQUIDADA,13/02/2020 16:39,,14/02/2020 12:06,,Victor - 2020-02-13 16:40:07 - REANUDACION ,,,,
12506061,,1910200230202,Reventa Datos,Lineas Nuevas,,EN PROCESO,13/02/2020 16:31,,,,Elizabeth - 2020-02-13 16:32:47 - FRENTE CENTRO DE BARRIOS ,,,,
12506060,,1910200230199,Reventa Datos,Reanudacion,,LIQUIDADA,13/02/2020 16:30,,13/02/2020 16:34,,Victor - 2020-02-13 16:31:33 - REANUDACION ,,,,
12506051,,1910200230189,Reventa Datos,Lineas Nuevas,,OBJETADA,13/02/2020 16:28,,13/02/2020 16:47,,Elizabeth - 2020-02-13 16:42:14 - A DOS CUADRAS DE CORPORATIVO ECOCHEM OK XD ,,,,
12505827,,1910200230087,Reventa Datos,Lineas Nuevas,,EN PROCESO,13/02/2020 15:29,,,,,,,,
12505825,,1910200230082,Reventa Datos,Lineas Nuevas,,OBJETADA,13/02/2020 15:27,,18/02/2020 16:01,,"Marian - 2020-02-18 14:45:56 - Se objeta solicitud, tecnico CS no acudio. Elizabeth - 2020-02-13 15:31:36 - A LADO DEL RASTRO CASA COLOR NARANJA CON PORTON BLANCA 1 PLANTA ",,,,
12505811,,1910200230058,Reventa Datos,Lineas Nuevas,,EN PROCESO DE ALTA,13/02/2020 15:15,,,,,,,,
12505802,,1910200230045,Reventa Datos,Lineas Nuevas,,EN PROCESO,13/02/2020 15:07,,,,,,,,
12505781,,1910200230036,Reventa Datos,Lineas Nuevas,,EN PROCESO,13/02/2020 15:05,,,,,,,,
12505684,,1910200230027,Reventa Datos,Lineas Nuevas,,EN PROCESO,13/02/2020 14:58,,,,,,,,
12505656,,1910200229994,Reventa Datos,Lineas Nuevas,,LIQUIDADA,13/02/2020 14:40,,20/02/2020 11:05,,,,,,
12505514,,1910200229935,Reventa Datos,Lineas Nuevas,,DOMICILIO SIN FACILIDADES,13/02/2020 14:10,,,,Elizabeth - 2020-02-13 14:11:05 - FRENTE A ESCUELA ULTIMA PRIVADA LADO IZQUIERDO ,,,,
12505460,,1910200229902,Reventa Datos,Lineas Nuevas,,OBJETADA,13/02/2020 13:57,,20/02/2020 10:33,,,,,,
12505143,,1910200229813,Reventa Datos,Lineas Nuevas,,EN PROCESO DE ALTA,13/02/2020 13:27,,13/02/2020 13:37,,,,,,
12504989,,1910200229788,Reventa Datos,Lineas Nuevas,,EN PROCESO,13/02/2020 13:18,,,,"Elizabeth - 2020-02-13 13:19:29 - CASA ROJO 2 NIVELES, CERCA DE PIZZAS DEL HORNO NEGRO ",,,,
12504985,,1910200229781,Reventa Datos,Lineas Nuevas,,EN PROCESO,13/02/2020 13:17,,,,,,,,
12504976,,1910200229774,Reventa Datos,Lineas Nuevas,,EN PROCESO,13/02/2020 13:14,,,,,,,,
12504843,,1910200229678,Reventa Datos,Lineas Nuevas,,EN PROCESO,13/02/2020 12:44,,,,Elizabeth - 2020-02-13 13:08:44 - NA ,,,,
12504823,,1910200229660,Reventa Datos,Lineas Nuevas,,EN PROCESO,13/02/2020 12:39,,,,,,,,
12504703,,1910200229563,Reventa Datos,Lineas Nuevas,,EN PROCESO,13/02/2020 11:58,,,,,,,,
12504558,,1910200229421,Reventa Datos,Lineas Nuevas,,,13/02/2020 11:25,,13/02/2020 11:54,,,,,,
12504447,,1910200229375,Reventa Datos,Lineas Nuevas,,EN PROCESO,13/02/2020 11:13,,,,Elizabeth - 2020-02-13 11:18:55 - SIN REFERENCIAS Elizabeth - 2020-02-13 11:15:34 - FACHADA DE MARMOL ROSA CON GRIS PUERTA CAFE CON BOLITAS DORADAS LOCAL DE LENCERIA AUN LADO Y POLLO FELIZ ,,,,
12504380,,1910200229313,Reventa Datos,Lineas Nuevas,,EN PROCESO,13/02/2020 10:55,,,,,,,,
12504369,,1910200229300,Reventa Datos,Lineas Nuevas,,EN PROCESO,13/02/2020 10:52,,,,,,,,
12504353,,1910200229287,Reventa Datos,Lineas Nuevas,,EN PROCESO,13/02/2020 10:48,,,,,,,,
12504321,,1910200229242,Reventa Datos,Lineas Nuevas,,LIQUIDADA,13/02/2020 10:40,19/02/2020,19/02/2020 17:17,,,,,,
12504227,,1910200229136,Reventa Datos,Lineas Nuevas,,EN PROCESO,13/02/2020 10:11,,,,,,,,
12504212,,1910200229120,Reventa Datos,Lineas Nuevas,,EN PROCESO DE ALTA,13/02/2020 10:06,,,,,,,,
12504208,,1910200229114,Reventa Datos,Lineas Nuevas,,EN PROCESO,13/02/2020 10:05,,,,,,,,
12504087,,1910200229096,Reventa Datos,Lineas Nuevas,,EN PROCESO,13/02/2020 09:55,,,,Elizabeth - 2020-02-13 09:56:18 - CERCA DE UNA TIENDA ,,,,
12504086,,1910200229093,Reventa Datos,Lineas Nuevas,,EN PROCESO,13/02/2020 09:55,,,,,,,,
12504071,,1910200229081,Reventa Datos,Lineas Nuevas,,EN PROCESO,13/02/2020 09:48,,,,,,,,
12503939,,1910200229043,Reventa Datos,Lineas Nuevas,,EN PROCESO,13/02/2020 09:18,,,,,,,,
12503929,,1910200229036,Reventa Datos,Lineas Nuevas,,LIQUIDADA,13/02/2020 09:07,,20/02/2020 12:05,,,,,,
12503925,,1910200229032,Reventa Datos,Lineas Nuevas,,EN PROCESO,13/02/2020 09:06,,,,,,,,
12503854,,1910200229025,Reventa Datos,Lineas Nuevas,,OBJETADA,13/02/2020 08:55,,17/02/2020 13:02,,,,,,
12503829,,1910200229013,Reventa Datos,Lineas Nuevas,,EN PROCESO,13/02/2020 08:12,,,,,,,,
12503804,,1910200228981,Reventa Datos,Lineas Nuevas,,EN PROCESO,12/02/2020 20:41,,,,,,,,
12503799,,1910200228961,Reventa Datos,Lineas Nuevas,,LIQUIDADA,12/02/2020 20:31,,19/02/2020 17:26,,"Marian - 2020-02-19 17:22:58 - Se realiza instalacion dejando el servicio navegando con entrega de modem correcto ?recibe en domicilio Daniel Rodriguez, tecnico CS ?no acudio. ",,,,
12503798,,1910200228954,Reventa Datos,Lineas Nuevas,,OBJETADA,12/02/2020 20:29,,19/02/2020 15:49,,"Marian - 2020-02-19 15:42:59 - Se objeta solicitud, tecnico CS no acudio. ",,,,
12503785,,1910200228921,Reventa Datos,Lineas Nuevas,,EN PROCESO,12/02/2020 20:17,,,,Victor - 2020-02-12 20:18:23 - SE ENCUENTRA TEMPLO SAN JUAN A TRES CUADRAS DE DOMICILIO ,,,,
12503731,,1910200228893,Reventa Datos,Lineas Nuevas,,EN PROCESO,12/02/2020 20:02,,,,,,,,
12503726,,1910200228886,Reventa Datos,Lineas Nuevas,,OBJETADA,12/02/2020 19:58,,13/02/2020 07:01,,,,,,
12503722,,1910200228880,Reventa Datos,Lineas Nuevas,,OBJETADA,12/02/2020 19:54,,19/02/2020 12:54,,"Marian - 2020-02-19 12:45:24 - Se objeta solicitud, tecnico CS ?no acudio. Victor - 2020-02-12 19:58:56 - TIENDA LA PASADITA A MANO IZQ ",,,,
12503626,,1910200228798,Reventa Datos,Lineas Nuevas,,EN PROCESO,12/02/2020 18:52,,,,Victor - 2020-02-12 18:55:06 - REFACCIONARIA LA CARCACHITA A 5 M APROX ,,,,
12503623,,1910200228794,Reventa Datos,Lineas Nuevas,,LIQUIDADA,12/02/2020 18:51,19/02/2020,19/02/2020 13:22,,"Elizabeth - 2020-02-12 18:53:09 - ARBOL AFUERA, CALLE CERRADA OK XD ",,,,
12503618,,1910200228790,Reventa Datos,Lineas Nuevas,,LIQUIDADA,12/02/2020 18:50,,19/02/2020 11:32,,"Marian - 2020-02-19 11:39:38 - Se realiza instalacion dejando el servicio navegando con entrega de modem correcto ?recibe en domicilio Jose Guadalupe Gonzalez Polanco, tecnico CS no acudio. Elizabeth - 2020-02-12 18:51:02 - entrando por la calle de portes gil el primer fraccionamiento la casa la que topa saliendo de jose luis cuevas la calle ",,,,
12503597,,1910200228769,Reventa Datos,Lineas Nuevas,,EN PROCESO,12/02/2020 18:43,21/02/2020,,,Elizabeth - 2020-02-12 18:43:39 - ENTRE LA PRIMARIA ADOLFO RUIZ CORTINEZ Y MUEBLERIA ,,,,
12503555,,1910200228751,Reventa Datos,Lineas Nuevas,,LIQUIDADA,12/02/2020 18:30,,19/02/2020 12:08,,Elizabeth - 2020-02-12 18:38:04 - Casa una planta fachada blanca porton negro lado.derecho poste de Telmex lado izquierdo porton rojo casi topando a pared OK XD ,,,,
12503541,,1910200228735,Reventa Datos,Lineas Nuevas,,EN PROCESO,12/02/2020 18:24,,,,,,,,
12503520,,1910200228724,Reventa Datos,Lineas Nuevas,,LIQUIDADA,12/02/2020 18:16,19/02/2020,19/02/2020 13:07,,"Elizabeth - 2020-02-12 18:17:16 - AUN LADO DE LA PLANTA DE AGUA , CASA COLOR BEIGE CON GRIS OK XD ",,,,
12503512,,1910200228721,Reventa Datos,Lineas Nuevas,,EN PROCESO,12/02/2020 18:14,,,,"Victor - 2020-02-12 18:24:39 - CASA INMUEBLE SIN PINTAR 2 NIVELES, CARACTERISTICA C SIN PINT DE 2PI CERCA DE ABARROTES EL PRIMO ",,,,
12503500,,1910200228716,Reventa Datos,Lineas Nuevas,,EN PROCESO,12/02/2020 18:11,,,,,,,,
12503492,,1910200228704,Reventa Datos,Suspension,,LIQUIDADA,12/02/2020 18:06,,12/02/2020 18:31,,Victor - 2020-02-12 18:28:29 - SUSPENSION ,,,,
12503477,,1910200228692,Reventa Datos,Lineas Nuevas,,EN PROCESO,12/02/2020 18:03,,,,,,,,
12503399,,1910200228652,Reventa Datos,Lineas Nuevas,,EN PROCESO,12/02/2020 17:42,,,,Elizabeth - 2020-02-12 17:43:20 - OK XD ,,,,
12503325,,1910200228600,Reventa Datos,Lineas Nuevas,,EN PROCESO,12/02/2020 17:24,,,,"Marian - 2020-02-19 10:46:10 - Se objeta solicitud, tecnico CS no?acudio. Elizabeth - 2020-02-12 17:25:08 - CASA DE 2 PISOS PORTON GRIS BARDA DE PIEDRA A UN COSTADO TIENDA TEJADON ESPERANZA OK XD ",,,,
12503293,,1910200228571,Reventa Datos,Suspension,,LIQUIDADA,12/02/2020 17:16,,12/02/2020 17:20,,Victor - 2020-02-12 17:19:01 - SUSPENSION ,,,,
12503279,,1910200228554,Reventa Datos,Lineas Nuevas,,EN PROCESO,12/02/2020 17:12,,,,Elizabeth - 2020-02-12 17:12:50 - FRENTE TORRE DE LUZ ,,,,
12503273,,1910200228546,Reventa Datos,Lineas Nuevas,,OBJETADA,12/02/2020 17:11,19/02/2020,20/02/2020 11:24,,"Marian - 2020-02-19 20:33:27 - Se objeta solicitud, tecnico CS no acudio. ",,,,
12503268,,1910200228541,Reventa Datos,Suspension,,LIQUIDADA,12/02/2020 17:10,,12/02/2020 17:17,,Victor - 2020-02-12 17:14:28 - SUSPENSION ,,,,
12503255,,1910200228529,Reventa Datos,Suspension,,LIQUIDADA,12/02/2020 17:08,,12/02/2020 17:10,,Victor - 2020-02-12 17:08:51 - SUSPENSION ,,,,
12503226,,1910200228502,Reventa Datos,Lineas Nuevas,,,12/02/2020 17:03,,12/02/2020 17:06,,,,,,
12503222,,1910200228498,Reventa Datos,Reanudacion,,LIQUIDADA,12/02/2020 17:02,,12/02/2020 17:05,,Victor - 2020-02-12 17:03:35 - REANUDACION ,,,,
12503112,,1910200228465,Reventa Datos,Lineas Nuevas,,,12/02/2020 16:54,,12/02/2020 17:01,,,,,,
12503093,,1910200228447,Reventa Datos,Reanudacion,,LIQUIDADA,12/02/2020 16:50,,12/02/2020 16:53,,Victor - 2020-02-12 16:52:55 - REANUDACION ,,,,
12503079,,1910200228437,Reventa Datos,Reanudacion,,LIQUIDADA,12/02/2020 16:48,,12/02/2020 16:51,,Victor - 2020-02-12 16:49:20 - REANUDACION ,,,,
12503078,,1910200228433,Reventa Datos,Lineas Nuevas,,LIQUIDADA,12/02/2020 16:48,,19/02/2020 12:14,,Elizabeth - 2020-02-12 16:49:28 - A UNAS CUADRAS DEL DOMICILIO HAY UN TEMPLO ,,,,
12503070,,1910200228427,Reventa Datos,Lineas Nuevas,,LIQUIDADA,12/02/2020 16:46,,19/02/2020 13:37,,,,,,
12503069,,1910200228423,Reventa Datos,Lineas Nuevas,,EN PROCESO,12/02/2020 16:44,,,,Elizabeth - 2020-02-12 16:46:23 - CASA DE MATERIA COLOR NARANJA ADELANTE DE LA GASOLINERIA OK XD ,,,,
12503067,,1910200228420,Reventa Datos,Reanudacion,,LIQUIDADA,12/02/2020 16:43,,12/02/2020 16:47,,Victor - 2020-02-12 16:44:27 - REANUDACION ,,,,
12503055,,1910200228406,Reventa Datos,Lineas Nuevas,,EN PROCESO,12/02/2020 16:39,,,,Elizabeth - 2020-02-12 16:40:00 - CERCA DE IGLESIA DE 12 APOSTOLES A 50 METROS ,,,,
12502967,,1910200228324,Reventa Datos,Lineas Nuevas,,LIQUIDADA,12/02/2020 16:11,,19/02/2020 14:17,,,,,,
12502965,,1910200228319,Reventa Datos,Lineas Nuevas,,LIQUIDADA,12/02/2020 16:10,,17/02/2020 12:53,,"Victor - 2020-02-12 16:12:25 - EN FRENTE DE LA CASA ESTA UN COMPUMIX, Y CERCA DE LA CARNICERIA ALLENDE ",,,,
12502940,,1910200228286,Reventa Datos,Lineas Nuevas,,EN PROCESO,12/02/2020 15:59,,,,"Marian - 2020-02-19 11:03:38 - Se objeta solicitud, tecnico CS no?acudio. ",,,,
12502913,,1910200228253,Reventa Datos,Lineas Nuevas,,OBJETADA,12/02/2020 15:45,,18/02/2020 15:30,,"Marian - 2020-02-18 19:43:38 - Se objeta solicitud, tecnico CS no acudio. Guadalupe - 2020-02-12 15:48:10 - Condominio azul con naranja entrada libre ",,,,
12502902,,1910200228234,Reventa Datos,Lineas Nuevas,,OBJETADA,12/02/2020 15:36,,18/02/2020 11:23,,Guadalupe - 2020-02-12 15:37:11 - Fachada gris un nivel puerta blanca ,,,,
12502897,,1910200228225,Reventa Datos,Lineas Nuevas,,OBJETADA,12/02/2020 15:34,,19/02/2020 12:02,,"Marian - 2020-02-19 11:55:03 - Se objeta solicitud, tecnico CS no?acudio. ",,,,
12502871,,1910200228197,Reventa Datos,Lineas Nuevas,,LIQUIDADA,12/02/2020 15:13,,19/02/2020 10:57,,,,,,
12502855,,1910200228183,Reventa Datos,Lineas Nuevas,,OBJETADA,12/02/2020 15:04,19/02/2020,20/02/2020 09:01,,"Marian - 2020-02-19 14:21:29 - Se objeta solicitud, tecnico CS?no acudio. Elizabeth - 2020-02-12 16:34:58 - frente a abarrotes reyna OK XD ",,,,
12502852,,1910200228179,Reventa Datos,Lineas Nuevas,,EN PROCESO,12/02/2020 15:02,,,,Guadalupe - 2020-02-12 15:02:34 - LADO EXPENDIO DE COCA ,,,,
12502783,,1910200228146,Reventa Datos,Lineas Nuevas,,EN PROCESO,12/02/2020 14:45,,,,Guadalupe - 2020-02-12 14:46:03 - CASA VERDE UN PISO ,,,,
12502758,,1910200228125,Reventa Datos,Lineas Nuevas,,OBJETADA,12/02/2020 14:32,,19/02/2020 12:48,,"Marian - 2020-02-19 17:16:20 - Se objeta solicitud, tecnico CS no acudio. ",,,,
12502735,,1910200228109,Reventa Datos,Lineas Nuevas,,EN PROCESO,12/02/2020 14:24,,,,Elizabeth - 2020-02-12 14:25:50 - SE ENCUENTRA UNA IGLESIA Y A MEDIA CUADRA SE ENCUENTRA EL DOMICILIO ,,,,
12502688,,1910200228074,Reventa Datos,Lineas Nuevas,,EN PROCESO,12/02/2020 14:08,,,,"Elizabeth - 2020-02-12 14:10:31 - CASA BLANCO 1 NIVEL, ENSEGUIDA DE ALBERCA LINDAVISTA ",,,,
12502683,,1910200228071,Reventa Datos,Lineas Nuevas,,EN PROCESO,12/02/2020 14:06,,,,Elizabeth - 2020-02-12 14:07:31 - NA ,,,,
12502662,,1910200228052,Reventa Datos,Lineas Nuevas,,EN PROCESO,12/02/2020 13:59,,,,,,,,
12502654,,1910200228039,Reventa Datos,Lineas Nuevas,,EN PROCESO,12/02/2020 13:55,,,,,,,,
12502631,,1910200228022,Reventa Datos,Lineas Nuevas,,LIQUIDADA,12/02/2020 13:48,,19/02/2020 13:33,,"Roberto - 2020-02-19 15:01:23 - Se realiza instalacion dejando el servicio navegando con entrega de modem correcto recibe en domicilio Candy Viridiana Ramirez, tecnico CS no acudio. ",,,,
12502590,,1910200227974,Reventa Datos,Lineas Nuevas,,EN PROCESO,12/02/2020 13:37,,,,,,,,
12502588,,1910200227968,Reventa Datos,Lineas Nuevas,,EN PROCESO,12/02/2020 13:37,,,,Elizabeth - 2020-02-12 13:38:38 - NA ,,,,
12502576,,1910200227957,Reventa Datos,Lineas Nuevas,,EN PROCESO,12/02/2020 13:34,,,,Elizabeth - 2020-02-12 13:36:15 - FRENTE CANCHA DE ESCUELA ,,,,
12502568,,1910200227949,Reventa Datos,Lineas Nuevas,,EN PROCESO,12/02/2020 13:33,,,,,,,,
12502541,,1910200227917,Reventa Datos,Lineas Nuevas,,LIQUIDADA,12/02/2020 13:28,,19/02/2020 11:51,,,,,,
12502497,,1910200227879,Reventa Datos,Lineas Nuevas,,LIQUIDADA,12/02/2020 13:16,,19/02/2020 16:09,,,,,,
12502441,,1910200227828,Reventa Datos,Lineas Nuevas,,EN PROCESO,12/02/2020 13:01,,,,,,,,
12502438,,1910200227825,Reventa Datos,Lineas Nuevas,,EN PROCESO,12/02/2020 13:00,,,,"Marian - 2020-02-19 18:24:28 - Se objeta solicitud con motivo domicilio no corresponde, valida CS Maria Azucena Moreno. ",,,,
12502406,,1910200227804,Reventa Datos,Lineas Nuevas,,OBJETADA,12/02/2020 12:52,,17/02/2020 14:52,,,,,,
12502399,,1910200227792,Reventa Datos,Lineas Nuevas,,EN PROCESO,12/02/2020 12:50,20/02/2020,,,,,,,
12502386,,1910200227780,Reventa Datos,Lineas Nuevas,,EN PROCESO,12/02/2020 12:49,,,,,,,,
12502374,,1910200227762,Reventa Datos,Lineas Nuevas,,OBJETADA,12/02/2020 12:44,,12/02/2020 13:10,,,,,,
12502365,,1910200227749,Reventa Datos,Lineas Nuevas,,EN PROCESO,12/02/2020 12:40,,,,,,,,
12502348,,1910200227734,Reventa Datos,Lineas Nuevas,,OBJETADA,12/02/2020 12:34,,19/02/2020 15:55,,,,,,
12502345,,1910200227728,Reventa Datos,Lineas Nuevas,,EN PROCESO,12/02/2020 12:32,,,,,,,,
12502268,,1910200227649,Reventa Datos,Lineas Nuevas,,EN PROCESO,12/02/2020 12:12,,,,,,,,
12502259,,1910200227635,Reventa Datos,Lineas Nuevas,,EN PROCESO,12/02/2020 12:09,,,,,,,,
12502241,,1910200227614,Reventa Datos,Lineas Nuevas,,EN PROCESO,12/02/2020 12:05,,,,,,,,
12502234,,1910200227602,Reventa Datos,Lineas Nuevas,,EN PROCESO,12/02/2020 12:03,,,,"Elizabeth - 2020-02-12 12:05:21 - EN LA ESQUINA SE ENCUENTRA UNA TIENDA ABARROTES IBARRA , SE VISUALIZA LA FRABRICA DEL PURO POLLO Y A UN LADO ESTA EL DOMICILIO ",,,,
12502219,,1910200227582,Reventa Datos,Lineas Nuevas,,OBJETADA,12/02/2020 11:59,,19/02/2020 13:39,,"Marian - 2020-02-19 13:27:13 - Se objeta solicitud, tecnico CS ?no acudio. ",,,,
12502192,,1910200227557,Reventa Datos,Lineas Nuevas,,EN PROCESO,12/02/2020 11:51,,,,Juan - 2020-02-12 11:56:30 - TIENDA DO•A LUPITA A DOS CALLES Y AFUERA DE DOM MACETA DE ZAPOTE ,,,,
12502188,,1910200227544,Reventa Datos,Lineas Nuevas,,EN PROCESO,12/02/2020 11:50,,,,Guadalupe - 2020-02-12 11:51:05 - FRENTE A LA CAPILLA ,,,,
12502179,,1910200227537,Reventa Datos,Lineas Nuevas,,EN PROCESO,12/02/2020 11:48,,,,,,,,
12502173,,1910200227530,Reventa Datos,Lineas Nuevas,,EN PROCESO,12/02/2020 11:47,,,,,,,,
12502138,,1910200227486,Reventa Datos,Lineas Nuevas,,EN PROCESO,12/02/2020 11:37,,,,,,,,
12502078,,1910200227436,Reventa Datos,Lineas Nuevas,,EN PROCESO,12/02/2020 11:23,,,,,,,,
12502068,,1910200227423,Reventa Datos,Lineas Nuevas,,OBJETADA,12/02/2020 11:21,,19/02/2020 10:42,,"Marian - 2020-02-19 10:30:51 - Se objeta solicitud, tecnico CS no?acudio. ",,,,
12502063,,1910200227413,Reventa Datos,Lineas Nuevas,,EN PROCESO,12/02/2020 11:19,,,,"Elizabeth - 2020-02-12 11:21:04 - EN LA ESQUINA DE LAS 5 CALLES ES UNA CASA VERDE DE 1 PLANTA, PORTON NEGRO CON 2 PALOMAS EN LA PUERTA ",,,,
12502048,,1910200227398,Reventa Datos,Lineas Nuevas,,EN PROCESO,12/02/2020 11:14,,,,,,,,
12502037,,1910200227389,Reventa Datos,Lineas Nuevas,,EN PROCESO,12/02/2020 11:10,,,,,,,,
12502030,,1910200227378,Reventa Datos,Lineas Nuevas,,EN PROCESO,12/02/2020 11:08,,,,"Marian - 2020-02-18 16:56:58 - Se objeta solicitud, tecnico CS ?no acudio. ",,,,
12502029,,1910200227375,Reventa Datos,Lineas Nuevas,,EN PROCESO,12/02/2020 11:08,,,,Elizabeth - 2020-02-12 11:09:11 - NA ,,,,
12501957,,1910200227330,Reventa Datos,Lineas Nuevas,,EN PROCESO,12/02/2020 10:56,,,,,,,,
12501932,,1910200227306,Reventa Datos,Lineas Nuevas,,OBJETADA,12/02/2020 10:49,,12/02/2020 11:04,,,,,,
12501907,,1910200227302,Reventa Datos,Lineas Nuevas,,LIQUIDADA,12/02/2020 10:47,,19/02/2020 10:48,,,,,,
12501898,,1910200227287,Reventa Datos,Lineas Nuevas,,OBJETADA,12/02/2020 10:44,,12/02/2020 11:01,,,,,,
12501889,,1910200227276,Reventa Datos,Lineas Nuevas,,EN PROCESO,12/02/2020 10:40,,,,Elizabeth - 2020-02-12 10:45:01 - NA ,,,,
12501858,,1910200227230,Reventa Datos,Lineas Nuevas,,EN PROCESO,12/02/2020 10:27,,,,,,,,
12501834,,1910200227205,Reventa Datos,Lineas Nuevas,,EN PROCESO,12/02/2020 10:17,,,,Elizabeth - 2020-02-12 10:19:15 - ANTES DE LLEGAR AL ZOOLOGICO CASA COLO BLANCO AFUERA UN JARDIN GRANDE ,,,,
12501788,,1910200227150,Reventa Datos,Lineas Nuevas,,EN PROCESO,12/02/2020 10:03,,,,,,,,
12501777,,1910200227129,Reventa Datos,Lineas Nuevas,,EN PROCESO,12/02/2020 09:58,,,,,,,,
12501772,,1910200227124,Reventa Datos,Lineas Nuevas,,OBJETADA,12/02/2020 09:57,,19/02/2020 12:00,,"Marian - 2020-02-19 18:28:22 - Se objeta solicitud con motivo domicilio no corresponde, valida CS Maria Azucena Moreno. Guadalupe - 2020-02-12 09:58:00 - UNA CUADRA ANTES DE LA BASE DE LAS COMBIS ENFRENTE DE LA AYUDANTIA , ENFRENTE DEL JUEGO SUBE Y BAJA ",,,,
12501753,,1910200227085,Reventa Datos,Lineas Nuevas,,EN PROCESO,12/02/2020 09:49,,,,,,,,
12501752,,1910200227084,Reventa Datos,Lineas Nuevas,,EN PROCESO,12/02/2020 09:49,,,,,,,,
12501735,,1910200227061,Reventa Datos,Lineas Nuevas,,LIQUIDADA,12/02/2020 09:44,,19/02/2020 12:22,,,,,,
12501707,,1910200227027,Reventa Datos,Lineas Nuevas,,EN PROCESO,12/02/2020 09:35,,,,"Elizabeth - 2020-02-12 09:38:47 - CASA ROJO 1 NIVEL, CERCA DE PRIMARIA ",,,,
12501680,,1910200227011,Reventa Datos,Lineas Nuevas,,EN PROCESO,12/02/2020 09:29,,,,Elizabeth - 2020-02-12 09:30:20 - hay una farmacia llamada farma com y un CNH CASA DUPLEX VERDE EN LA PARTE DE ARRIBA ,,,,
12501678,,1910200227009,Reventa Datos,Lineas Nuevas,,EN PROCESO,12/02/2020 09:28,,,,,,,,
12501670,,1910200227004,Reventa Datos,Lineas Nuevas,,EN PROCESO,12/02/2020 09:26,,,,Guadalupe - 2020-02-12 09:30:19 - Guadalupe - 2020-02-12 09:30:19 - Guadalupe - 2020-02-12 09:30:18 - CASA BLANCA X CAPILLA GUADALUPE VICTORIA ,,,,
12501655,,1910200226988,Reventa Datos,Lineas Nuevas,,EN PROCESO,12/02/2020 09:16,,,,,,,,
12501642,,1910200226979,Reventa Datos,Lineas Nuevas,,EN PROCESO,12/02/2020 09:15,,,,,,,,
12501641,,1910200226977,Reventa Datos,Reanudacion,,LIQUIDADA,12/02/2020 09:14,,12/02/2020 09:19,,Ariadna - 2020-02-12 09:15:54 - REANUDACION ,,,,
12501637,,1910200226971,Reventa Datos,Lineas Nuevas,,EN PROCESO,12/02/2020 09:12,,,,,,,,
12501623,,1910200226956,Reventa Datos,Lineas Nuevas,,OBJETADA,12/02/2020 08:59,,19/02/2020 18:09,,"Marian - 2020-02-19 18:14:09 - Se objeta solicitud, tecnico CS no acudio. ",,,,
12501598,,1910200226930,Reventa Datos,Lineas Nuevas,,EN PROCESO DE ALTA,12/02/2020 08:23,,,,,,,,
12501591,,1910200226910,Reventa Datos,Lineas Nuevas,,LIQUIDADA,12/02/2020 08:04,,19/02/2020 12:54,,"Marian - 2020-02-19 12:54:35 - Se realiza instalacion dejando el servicio navegando con entrega de modem correcto ?recibe en domicilio Rene Gonzalez Morales, tecnico CS ?no acudio. ",,,,
12501420,,1910200226875,Reventa Datos,Reanudacion,,LIQUIDADA,11/02/2020 21:04,,11/02/2020 21:10,,Guadalupe - 2020-02-11 21:07:38 - REANUDACI‡N ,,,,
12501418,,1910200226871,Reventa Datos,Lineas Nuevas,,OBJETADA,11/02/2020 20:57,,18/02/2020 17:59,,Victor - 2020-02-11 21:00:05 - TIENDA A MEDIA CALLE ,,,,
12501413,,1910200226856,Reventa Datos,Lineas Nuevas,,EN PROCESO,11/02/2020 20:47,,,,Elizabeth - 2020-02-11 20:48:16 - FRENTE AL JARDIN DE NI•OS TAMAULIPAS ,,,,
12501412,,1910200226853,Reventa Datos,Lineas Nuevas,,OBJETADA,11/02/2020 20:46,,18/02/2020 19:18,,"Marian - 2020-02-18 18:22:34 - Se objeta solicitud, tecnico CS no acudio. ",,,,
12501407,,1910200226834,Reventa Datos,Lineas Nuevas,,EN PROCESO,11/02/2020 20:31,,,,Elizabeth - 2020-02-11 20:32:17 - CERCA DE UN SIX Y A DOS CUADRAS UN 7-ELEVEN ,,,,
12501400,,1910200226815,Reventa Datos,Lineas Nuevas,,LIQUIDADA,11/02/2020 20:17,19/02/2020,19/02/2020 14:21,,Elizabeth - 2020-02-11 20:21:16 - reja negra ,,,,
12501390,,1910200226788,Reventa Datos,Lineas Nuevas,,OBJETADA,11/02/2020 20:01,,18/02/2020 12:16,,"Marian - 2020-02-18 12:07:14 - Se objeta solicitud ,tecnico CS ?no acudio. ",,,,
12501378,,1910200226769,Reventa Datos,Lineas Nuevas,,EN PROCESO,11/02/2020 19:51,,,,,,,,
12501368,,1910200226759,Reventa Datos,Lineas Nuevas,,OBJETADA,11/02/2020 19:47,,18/02/2020 15:03,,Marian - 2020-02-18 20:17:37 - Se objeta solicitud cliente no desea el servicio a peticion de CS Pablo Barnica. ,,,,
12501360,,1910200226748,Reventa Datos,Lineas Nuevas,,OBJETADA,11/02/2020 19:39,,18/02/2020 16:36,,"Erick - 2020-02-11 19:40:34 - ENFRENTE DE UN HOTEL LLAMADA VISTA CORONA, ES LA ULTIMA CALLE AHI TOPA. ",,,,
12501356,,1910200226743,Reventa Datos,Lineas Nuevas,,OBJETADA,11/02/2020 19:36,,19/02/2020 10:50,,,,,,
12501345,,1910200226734,Reventa Datos,Lineas Nuevas,,EN PROCESO,11/02/2020 19:30,,,,"Marian - 2020-02-18 10:15:38 - Se objeta solicitud ,tecnico CS ?no acudio. Elizabeth - 2020-02-11 19:31:13 - ENFRENTE DE ABAROTES ANITA OK XD ",,,,
12501323,,1910200226719,Reventa Datos,Lineas Nuevas,,DOMICILIO SIN FACILIDADES,11/02/2020 19:23,,,,,,,,
12501168,,1910200226647,Reventa Datos,Lineas Nuevas,,OBJETADA,11/02/2020 18:45,,19/02/2020 16:56,,"Marian - 2020-02-19 16:57:28 - Se objeta solicitud, tecnico CS ?no acudio. Elizabeth - 2020-02-11 18:45:31 - 19.1253536,-104.3442986, A UNA CUADRA DEL SUPER ""DON JORGE"" ",,,,
12501146,,1910200226632,Reventa Datos,Lineas Nuevas,,OBJETADA,11/02/2020 18:40,,19/02/2020 18:16,,"Elizabeth - 2020-02-11 18:41:21 - 19.1253536,-104.3442986, A UNA CUADRA DEL SUPER ""DON JORGE"" ",,,,
12501127,,1910200226627,Reventa Datos,Lineas Nuevas,,EN PROCESO DE ALTA,11/02/2020 18:37,,,,,,,,
12501110,,1910200226617,Reventa Datos,Lineas Nuevas,,EN PROCESO,11/02/2020 18:35,,,,"Erick - 2020-02-11 18:35:53 - CASA DE IN PISO, CON AZULEJOS CAFES, PUERTAS NEGRAS, A UN LADO DE UN CONSULTORIO DENTAL ",,,,
12501078,,1910200226605,Reventa Datos,Lineas Nuevas,,EN PROCESO,11/02/2020 18:31,,,,"Elizabeth - 2020-02-11 18:32:34 - A UNA CALLE DEL MERCADO, Y A LA VUELTA DEL CENTRO DE SALUD DR. JORGE JIMENEZ CANTU, LA CALLE SIGUIENTE A LA ROSTICERIA BRENDA, EN LA MISMA CALLE NO SE ENCUENTRA ALGUNA OTRA REFERENCIA ESPECIFICA ",,,,
12501068,,1910200226598,Reventa Datos,Lineas Nuevas,,LIQUIDADA,11/02/2020 18:30,,18/02/2020 17:42,,,,,,
12500918,,1910200226534,Reventa Datos,Lineas Nuevas,,EN PROCESO,11/02/2020 17:53,18/02/2020,,,,,,,
12500844,,1910200226474,Reventa Datos,Lineas Nuevas,,LIQUIDADA,11/02/2020 17:31,,18/02/2020 14:26,,"Victor - 2020-02-11 17:33:50 - CERCA DE INPECCION DE POLICIA , POZO DE AGUA Y TACOBIT ",,,,
12500842,,1910200226472,Reventa Datos,Lineas Nuevas,,OBJETADA,11/02/2020 17:31,,18/02/2020 20:05,,"Erick - 2020-02-11 17:32:16 - CASA MELON, CON PUERTA CAFFE, ESTA UN OXXO CERCAS AL CUATA CASA A MANO DERECHA. ",,,,
12500782,,1910200226421,Reventa Datos,Reanudacion,,LIQUIDADA,11/02/2020 17:16,,11/02/2020 17:23,,Victor - 2020-02-11 17:17:20 - REANUDACION ,,,,
12500773,,1910200226411,Reventa Datos,Lineas Nuevas,,OBJETADA,11/02/2020 17:14,,18/02/2020 16:21,,Elizabeth - 2020-02-11 17:17:00 - CERCAS DE LADY FACHION BOUTIQUE OK XD ,,,,
12500763,,1910200226404,Reventa Datos,Reanudacion,,LIQUIDADA,11/02/2020 17:13,,11/02/2020 17:16,,Victor - 2020-02-11 17:13:51 - REANUDACION ,,,,
12500716,,1910200226365,Reventa Datos,Lineas Nuevas,,EN PROCESO,11/02/2020 16:59,,,,Elizabeth - 2020-02-11 16:59:53 - OK XD ,,,,
12500713,,1910200226359,Reventa Datos,Lineas Nuevas,,EN PROCESO,11/02/2020 16:57,,,,"Marian - 2020-02-15 13:20:30 - Se objeta solicitud ,tecnico CS ?no acudio ",,,,
12500709,,1910200226357,Reventa Datos,Lineas Nuevas,,EN PROCESO,11/02/2020 16:56,18/02/2020,,,,,,,
12500692,,1910200226347,Reventa Datos,Reanudacion,,LIQUIDADA,11/02/2020 16:54,,11/02/2020 17:11,,Victor - 2020-02-11 17:09:19 - REANUDACION ,,,,
12500679,,1910200226334,Reventa Datos,Reanudacion,,LIQUIDADA,11/02/2020 16:51,,11/02/2020 16:53,,Victor - 2020-02-11 16:51:58 - REANUDACION ,,,,
12500656,,1910200226314,Reventa Datos,Lineas Nuevas,,OBJETADA,11/02/2020 16:47,,13/02/2020 09:35,,"Marian - 2020-02-18 19:04:28 - Se objeta solicitud, tecnico CS no acudio. Erick - 2020-02-11 16:47:43 - CASA COLOR VEIS CON NEGRO, PUERTAS BLANCAS, CON UNA FRANJAS DE PIEDRAS. ",,,,
12500653,,1910200226308,Reventa Datos,Lineas Nuevas,,OBJETADA,11/02/2020 16:46,,18/02/2020 17:22,,Elizabeth - 2020-02-11 16:46:40 - 0 ,,,,
12500640,,1910200226290,Reventa Datos,Reanudacion,,LIQUIDADA,11/02/2020 16:41,,11/02/2020 16:43,,Victor - 2020-02-11 16:42:24 - REANUDACION ,,,,
12500599,,1910200226258,Reventa Datos,Lineas Nuevas,,OBJETADA,11/02/2020 16:33,,17/02/2020 10:43,,"Roberto - 2020-02-13 14:24:29 - Se objeta solicitud cliente no desea el servicio a peticion de CS Daniel Rodriguez. Cecilia - 2020-02-11 16:36:02 - MANZANA 47 LOTE 23, CONTRA ESQUINA DE UNA TINTORERIA. PORTON NEGRO ",,,,
12500478,,1910200226121,Reventa Datos,Reanudacion,,LIQUIDADA,11/02/2020 15:42,,12/02/2020 07:00,,Victor - 2020-02-11 16:36:13 - REANUDACION ,,,,
12500477,,1910200226115,Reventa Datos,Lineas Nuevas,,EN PROCESO,11/02/2020 15:40,17/02/2020,,,Cecilia - 2020-02-11 15:41:37 - en contra esquina de tienda el picosito ,,,,
12500474,,1910200226110,Reventa Datos,Lineas Nuevas,,EN PROCESO,11/02/2020 15:36,,,,,,,,
12500407,,1910200226037,Reventa Datos,Lineas Nuevas,,EN PROCESO,11/02/2020 14:54,,,,,,,,
12500397,,1910200226022,Reventa Datos,Lineas Nuevas,,EN PROCESO,11/02/2020 14:49,,,,,,,,
12500396,,1910200226020,Reventa Datos,Lineas Nuevas,,EN PROCESO,11/02/2020 14:49,,,,,,,,
12500394,,1910200226017,Reventa Datos,Lineas Nuevas,,EN PROCESO,11/02/2020 14:48,,,,,,,,
12500372,,1910200226003,Reventa Datos,Lineas Nuevas,,EN PROCESO,11/02/2020 14:40,,,,,,,,
12500365,,1910200225994,Reventa Datos,Lineas Nuevas,,OBJETADA,11/02/2020 14:37,,18/02/2020 17:20,,"Marian - 2020-02-18 17:20:49 - Se objeta solicitud, tecnico CS no acudio. ",,,,
12500327,,1910200225970,Reventa Datos,Lineas Nuevas,,EN PROCESO,11/02/2020 14:25,,,,,,,,
12500306,,1910200225954,Reventa Datos,Lineas Nuevas,,OBJETADA,11/02/2020 14:16,,18/02/2020 12:15,,"Marian - 2020-02-18 12:19:21 - Se objeta solicitud, tecnico CS ?no acudio. ",,,,
12500288,,1910200225941,Reventa Datos,Lineas Nuevas,,EN PROCESO,11/02/2020 14:09,,,,Elizabeth - 2020-02-11 14:10:14 - ATRAS DE SU CASA ESTA EL SAM CLUB ,,,,
12500281,,1910200225933,Reventa Datos,Lineas Nuevas,,OBJETADA,11/02/2020 14:06,,18/02/2020 18:00,,"Marian - 2020-02-18 19:48:51 - Se objeta solicitud, tecnico CS no acudio. Samuel - 2020-02-11 14:07:06 - CERCA DE LA PREPARATORIA ",,,,
12500227,,1910200225889,Reventa Datos,Lineas Nuevas,,EN PROCESO,11/02/2020 13:55,,,,,,,,
12500226,,1910200225887,Reventa Datos,Lineas Nuevas,,EN PROCESO,11/02/2020 13:54,,,,,,,,
12500218,,1910200225882,Reventa Datos,Lineas Nuevas,,"Objetada, Modem No Recogido / No recibido",11/02/2020 13:52,,20/02/2020 10:56,,,,,,
12500205,,1910200225864,Reventa Datos,Lineas Nuevas,,LIQUIDADA,11/02/2020 13:50,,18/02/2020 15:25,,Elizabeth - 2020-02-11 13:50:44 - A UNA CUADRA DEL DOMICILIO ESTA EL MODELORAMA PROVINCIA Y LAS GORDITAS DO•A SANTOS ,,,,
12498815,,1910200224726,Reventa Datos,Lineas Nuevas,,OBJETADA,11/02/2020 08:14,,19/02/2020 09:43,,"Marian - 2020-02-19 09:44:14 - Se objeta solicitud ,tecnico CS ?no acudio. Victor - 2020-02-11 08:33:05 - CASA 1NV PUERTA NEGRA X ESCUELA VICTORIA ",,,,
12498808,,1910200224715,Reventa Datos,Lineas Nuevas,,OBJETADA,11/02/2020 08:02,,18/02/2020 09:48,,"Marian - 2020-02-18 09:46:58 - Se objeta solicitud, tecnico CS no acudio. ",,,,
12498745,,1910200224696,Reventa Datos,Lineas Nuevas,,EN PROCESO,10/02/2020 21:01,,,,,,,,
12498737,,1910200224674,Reventa Datos,Lineas Nuevas,,OBJETADA,10/02/2020 20:50,,18/02/2020 10:16,,"Marian - 2020-02-18 10:14:32 - Marian - 2020-02-18 10:14:32 - Se objeta solicitud, t?cnico CS no acudio. Victor - 2020-02-10 20:51:51 - ES FRACCIONAMIENTO SANTA ISABEL ",,,,
12498724,,1910200224643,Reventa Datos,Lineas Nuevas,,OBJETADA,10/02/2020 20:32,,19/02/2020 16:50,,Victor - 2020-02-10 20:35:03 - ESTA A 3 CUADRAS EL PARQUE REVOLUCION Y UNA TAQUERIA QUE SE LLAMA ARANDAS ,,,,
12498721,,1910200224632,Reventa Datos,Lineas Nuevas,,EN PROCESO,10/02/2020 20:29,,,,"Marian - 2020-02-17 11:26:31 - Se objeta solicitud, tecnico CS no acudio. ",,,,
12498716,,1910200224624,Reventa Datos,Lineas Nuevas,,OBJETADA,10/02/2020 20:26,,17/02/2020 13:30,,,,,,
12498712,,1910200224618,Reventa Datos,Lineas Nuevas,,EN PROCESO,10/02/2020 20:23,,,,,,,,
12498669,,1910200224543,Reventa Datos,Lineas Nuevas,,OBJETADA,10/02/2020 19:46,,17/02/2020 17:41,,"Marian - 2020-02-17 21:02:17 - Se objeta solicitud, tecnico CS no acudio. ",,,,
12498654,,1910200224532,Reventa Datos,Lineas Nuevas,,LIQUIDADA,10/02/2020 19:40,,17/02/2020 13:54,,"Marian - 2020-02-17 13:57:12 - Se realiza instalacion dejando el servicio navegando con entrega de modem correcto ?recibe en domicilio Mercedes Mojica Sosa , tecnico CS no acudio. ",,,,
12498646,,1910200224519,Reventa Datos,Lineas Nuevas,,OBJETADA,10/02/2020 19:35,,17/02/2020 19:50,,"Marian - 2020-02-17 19:38:40 - Se objeta solicitud ,tecnico CS no acudio. Elizabeth - 2020-02-10 19:52:29 - CERCA DEL CUARREL MILITAR ",,,,
12498634,,1910200224505,Reventa Datos,Lineas Nuevas,,LIQUIDADA,10/02/2020 19:29,,17/02/2020 12:34,,"Elizabeth - 2020-02-10 19:29:55 - en esquina o inicio de calle violetas, la cual queda en contra esquina con carril de san bartolo, esta ultima da acceso al parque estatal lazaro cardenas del rio, la vivienda esta en la cuchilla aislada, antes de la entrada del ya mencionado parque ",,,,
12498475,,1910200224357,Reventa Datos,Suspension,,LIQUIDADA,10/02/2020 18:33,,10/02/2020 18:44,,Victor - 2020-02-10 18:37:12 - SUSPENSION ,,,,
12498471,,1910200224348,Reventa Datos,Suspension,,LIQUIDADA,10/02/2020 18:31,,10/02/2020 18:33,,Victor - 2020-02-10 18:32:15 - SUSPENSION ,,,,
12498457,,1910200224336,Reventa Datos,Suspension,,LIQUIDADA,10/02/2020 18:27,,10/02/2020 18:31,,Victor - 2020-02-10 18:28:01 - SUSPENSION ,,,,
12498409,,1910200224302,Reventa Datos,Lineas Nuevas,,EN PROCESO,10/02/2020 18:14,,,,Marian - 2020-02-17 10:46:36 - Se objeta solicitud cliente no desea el servicio a petici?n de CS Daniel Rodriguez. Elizabeth - 2020-02-10 18:14:47 - CASA DE COLOR NARANJA CERCA DE UNA TIENDA SIS ,,,,
12498353,,1910200224272,Reventa Datos,Lineas Nuevas,,EN PROCESO,10/02/2020 18:03,,,,"Erick - 2020-02-10 18:04:30 - CASA RUSTICO, CERCAS LOCAL VERDE, CASA TIPO COLONIAL, CERCAS CAPILLA DE LA SANTA CRIZ ",,,,
12498332,,1910200224262,Reventa Datos,Lineas Nuevas,,OBJETADA,10/02/2020 18:00,16/02/2020,17/02/2020 11:18,,"Marian - 2020-02-16 12:39:34 - Se objeta solicitud con motivo domicilio no corresponde, valida CS Maria Azucena Moreno. ",,,,
12498326,,1910200224252,Reventa Datos,Suspension,,LIQUIDADA,10/02/2020 17:58,,10/02/2020 18:26,,Victor - 2020-02-10 18:22:53 - SUSPENSION ,,,,
12498288,,1910200224223,Reventa Datos,Suspension,,LIQUIDADA,10/02/2020 17:49,,10/02/2020 18:04,,Victor - 2020-02-10 17:56:59 - SUSPENSION ,,,,
12498263,,1910200224199,Reventa Datos,Suspension,,LIQUIDADA,10/02/2020 17:43,,10/02/2020 17:49,,Victor - 2020-02-10 17:48:02 - SUSPENSION ,,,,
12498202,,1910200224165,Reventa Datos,Suspension,,LIQUIDADA,10/02/2020 17:36,,10/02/2020 17:44,,Victor - 2020-02-10 17:42:06 - SUSPENSION ,,,,
12498189,,1910200224145,Reventa Datos,Suspension,,LIQUIDADA,10/02/2020 17:31,,10/02/2020 17:37,,Victor - 2020-02-10 17:35:52 - SUSPENSION ,,,,
12498156,,1910200224122,Reventa Datos,Suspension,,LIQUIDADA,10/02/2020 17:27,,10/02/2020 17:31,,Victor - 2020-02-10 17:29:41 - SUSPENSION ,,,,
12498137,,1910200224101,Reventa Datos,Lineas Nuevas,,EN PROCESO,10/02/2020 17:20,,,,,,,,
12498111,,1910200224090,Reventa Datos,Suspension,,LIQUIDADA,10/02/2020 17:17,,10/02/2020 17:27,,Victor - 2020-02-10 17:25:37 - SUSPENSION ,,,,
12498048,,1910200224043,Reventa Datos,Lineas Nuevas,,LIQUIDADA,10/02/2020 17:05,,17/02/2020 14:04,,"Marian - 2020-02-17 14:05:17 - Se realiza instalaci?n dejando el servicio navegando con entrega de modem correcto ?recibe en domicilio (Sayra Nava Blanco), tecnico CS ?no acudio ",,,,
12498016,,1910200224016,Reventa Datos,Reanudacion,,LIQUIDADA,10/02/2020 17:00,,10/02/2020 17:02,,Victor - 2020-02-10 17:00:29 - REANUDACION ,,,,
12498001,,1910200224002,Reventa Datos,Reanudacion,,LIQUIDADA,10/02/2020 16:57,,10/02/2020 16:59,,Victor - 2020-02-10 16:57:33 - REANUDACION ,,,,
12497970,,1910200223980,Reventa Datos,Lineas Nuevas,,OBJETADA,10/02/2020 16:50,,10/02/2020 16:57,,,,,,
12497933,,1910200223954,Reventa Datos,Lineas Nuevas,,OBJETADA,10/02/2020 16:42,,17/02/2020 17:44,,,,,,
12497931,,1910200223952,Reventa Datos,Lineas Nuevas,,EN PROCESO,10/02/2020 16:41,,,,,,,,
12497929,,1910200223950,Reventa Datos,Lineas Nuevas,,EN PROCESO,10/02/2020 16:41,,,,"Juan - 2020-02-10 16:43:02 - ATRAS DE LA ESCUELA SECUNDARIA FEDERAL NO 1,LIC SEBASTIAN LERDO DE TEJADA ",,,,
12497928,,1910200223948,Reventa Datos,Reanudacion,,LIQUIDADA,10/02/2020 16:41,,10/02/2020 16:46,,Victor - 2020-02-10 16:43:35 - REANUDACION ,,,,
12497920,,1910200223944,Reventa Datos,Lineas Nuevas,,OBJETADA,10/02/2020 16:39,,17/02/2020 14:10,,"Marian - 2020-02-17 14:08:03 - Se objeta solicitud, tecnico CS?no acudio. ",,,,
12497910,,1910200223926,Reventa Datos,Lineas Nuevas,,LIQUIDADA,10/02/2020 16:35,,17/02/2020 15:04,,,,,,
12497903,,1910200223917,Reventa Datos,Lineas Nuevas,,EN PROCESO,10/02/2020 16:33,,,,"Marian - 2020-02-19 20:01:39 - Se objeta solicitud, tecnico CS no acudio. ",,,,
12497895,,1910200223913,Reventa Datos,Reanudacion,,LIQUIDADA,10/02/2020 16:31,,10/02/2020 16:43,,Victor - 2020-02-10 16:40:19 - REANUDACION ,,,,
12497883,,1910200223904,Reventa Datos,Lineas Nuevas,,EN PROCESO,10/02/2020 16:28,,,,,,,,
12497872,,1910200223882,Reventa Datos,Reanudacion,,LIQUIDADA,10/02/2020 16:25,,10/02/2020 16:31,,Victor - 2020-02-10 16:29:08 - REANUDACION ,,,,
12497866,,1910200223873,Reventa Datos,Reanudacion,,LIQUIDADA,10/02/2020 16:22,,10/02/2020 16:25,,Victor - 2020-02-10 16:24:40 - REANUDACION ,,,,
12497848,,1910200223849,Reventa Datos,Lineas Nuevas,,LIQUIDADA,10/02/2020 16:18,,17/02/2020 16:01,,,,,,
12497825,,1910200223825,Reventa Datos,Reanudacion,,LIQUIDADA,10/02/2020 16:11,,10/02/2020 16:13,,Victor - 2020-02-10 16:12:08 - REANUDACION ,,,,
12497822,,1910200223821,Reventa Datos,Lineas Nuevas,,EN PROCESO,10/02/2020 16:11,,,,Cecilia - 2020-02-10 16:12:41 - aun costado de materiales beltran y frente al oxxo casa de 1 niv color gris entrar por un callejon aun lado de los materiales ,,,,
12497810,,1910200223802,Reventa Datos,Reanudacion,,LIQUIDADA,10/02/2020 16:06,,10/02/2020 16:09,,Victor - 2020-02-10 16:07:46 - REANUDACION ,,,,
12497787,,1910200223769,Reventa Datos,Lineas Nuevas,,EN PROCESO,10/02/2020 15:58,,,,"Marian - 2020-02-18 20:07:55 - Se objeta solicitud con motivo domicilio no corresponde, valida CS Maria Azucena Moreno. Juan - 2020-02-10 15:59:36 - CASA DE 1 PISO COLOR NARANJA ",,,,
12497779,,1910200223755,Reventa Datos,Lineas Nuevas,,EN PROCESO,10/02/2020 15:57,,,,"Marian - 2020-02-17 12:12:55 - Se realiza instalacion dejando el servicio navegando con entrega de modem correcto ?recibe en domicilio Valeria Ochoa, tecnico CS ?no acudio. ",,,,
12497772,,1910200223741,Reventa Datos,Lineas Nuevas,,EN PROCESO,10/02/2020 15:54,,,,,,,,
12497760,,1910200223713,Reventa Datos,Lineas Nuevas,,LIQUIDADA,10/02/2020 15:44,,14/02/2020 12:38,,,,,,
12497751,,1910200223698,Reventa Datos,Lineas Nuevas,,EN PROCESO,10/02/2020 15:39,,,,,,,,
12497744,,1910200223690,Reventa Datos,Lineas Nuevas,,LIQUIDADA,10/02/2020 15:37,,18/02/2020 11:59,,Juan - 2020-02-10 15:38:27 - ESTA CERCAS DE ABARROTES VELMER ,,,,
12497743,,1910200223687,Reventa Datos,Lineas Nuevas,,EN PROCESO,10/02/2020 15:37,,,,Victor - 2020-02-10 15:38:02 - A lado de una imprenta ,,,,
12497742,,1910200223682,Reventa Datos,Lineas Nuevas,,EN PROCESO,10/02/2020 15:36,,,,"Marian - 2020-02-17 13:04:09 - Se objeta solicitud con motivo domicilio no corresponde, valida CS Erick Arellano. Cecilia - 2020-02-10 15:40:31 - FRENTE CANCHA DE FUTBOL ",,,,
12497719,,1910200223663,Reventa Datos,Lineas Nuevas,,EN PROCESO,10/02/2020 15:32,,,,,,,,
12497709,,1910200223645,Reventa Datos,Lineas Nuevas,,OBJETADA,10/02/2020 15:27,,19/02/2020 11:03,,,,,,
12497702,,1910200223640,Reventa Datos,Lineas Nuevas,,LIQUIDADA,10/02/2020 15:24,,17/02/2020 20:17,,Victor - 2020-02-10 15:25:45 - atras de oxxo ,,,,
